,index,approveDate,commentBody,commentID,commentSequence,commentTitle,commentType,createDate,depth,editorsSelection,isAnonymous,parentID,parentUserDisplayName,permID,picURL,recommendations,recommendedFlag,replies,replyCount,status,trusted,updateDate,userDisplayName,userID,userLocation,userTitle,userURL
37,12,1575304444,There's no dilemma here. If this is good for trade and good for the US then just get it passed. The Democrats can easily use this to their advantage. Have a press conference and claim that this proves they put the country first and that the impeachment hearings are not stopping them from passing important bills. Take the high road Democrats.,103925726,103925726,<br\//>,comment,1575303805,1,False,False,,,103925726,,3,0,[],0,approved,0,1575312082,Linda,83814528,Anchorage,NULL,NULL
38,13,1575304443,"If you didn't like NAFTA, like Campaign Trump, you'll hate USMCA (NAFTA+) negotiated by President Trump. 

I happen to believe that NAFTA saved the North American auto industry and attracted assembly plants from all of the biggest automakers from Europe and Asia to the US. 

NAFTA+ encourages more auto parts production in Mexico rather than Europe and Asia. And it encourages more assembly work in the US and Canada. Canada has a 30%+ advantage in labor costs, and US labor unions are winning commitments to US investments, so balancing will continue.  And both Canada and Mexico have newer, more efficient and lower cost steel mills. 

US farmers gained huge exports to Mexico from NAFTA while Mexico provided a year round supply of crops like avocados, tripling US consumer demand. 

And the labor union promoting demands that NAFTA+ makes on Mexico are a tough pill for the GOP to swallow. 

This is the kind of balanced trade agreement the Democrats should get behind.",103925648,103925648,<br\//>,comment,1575303575,1,False,False,,,103925648,,6,0,[],0,approved,0,1575355626,Look Ahead,18426496,WA,NULL,NULL
39,14,1575304441,Free trade = free lunch. This equation does not compute in the real world. There’s no free lunch out here. Only in the White House it exists for those invited to the table. The rest of the folks can eat barnacles from the Chesapeake River.,103925602,103925602,<br\//>,comment,1575303418,1,False,False,,,103925602,,1,0,[],0,approved,0,1575305681,Jorge Uoxinton,72415766,Brooklyn,NULL,NULL
40,15,1575304439,"It is odd to say Trump ""is stealing from the Dems' Playbook""
and that the Dems ""have been fighting for this for years.""
No. Both Clintons were wedded to the old Wall Street trade deals Bill pioneered...in which you let financial and other corporate spokesmen meet in secret to hammer out their dream trade agreement, complete with big benefits for international corporations (pharmaceuticals and high tech corps were among the favorites in the Obama-Hillary agreement she described as ""the Gold Standard"" in trade agreements. Only for the elites, not labor, the environmentalist, or health and safety regulation. International and other large firms especially endorsed ISDS, Investor-State Dispute Settlement, which allowed corporations to sue governments for millions/billions if they passed regulations that ""reduced the industry's expected profits."" See <a href=""https://www.citizen.org/wp-content/uploads/investor-state-chart-aug-2018.pdf"" target=""_blank"">https://www.citizen.org/wp-content/uploads/investor-state-chart-aug-2018.pdf</a>.
Trump should get credit for insisting on abandoning the elitist trade agreements (which, by the way, were--in the case of Obama's TTIP, also rejected by Europe).",103925710,103925710,<br\//>,comment,1575303754,1,False,False,,,103925710,,4,0,[],0,approved,0,1575342344,Martha,29837088,"Dryden, NY",NULL,NULL
41,16,1575304300,"It is no more Trump's deal than it is Trudeau's and Freeland's (now our Deputy Prime Minister) or Seade's and López Obrador's. Speaking as a Canadian, I believe that Chrystia Freeland went home pleased with the negotations. Much of what we agreed upon had already been decided or was planned as a part of the NAFTA revisions. We don't consider that Canada made significant concessions and we do see benefits to be gained. 

Let us not give President Trump too much credit here. He didn't do this on his own, by any means. 

And we shall soon know how well he honours CUSMA's aka USMCA's stipulations if and when it is signed by all three parties involved. 

I hope it will accommodate the needs of each country. We have long worked together in partnership and mutual cooperation ought to continue to everyone's satisfaction.",103925886,103925886,<br\//>,comment,1575304299,1,False,False,,,103925886,,3,0,[],0,approved,0,1575316699,Brenda Tate,72511576,"Yarmouth, NS",NULL,NULL
42,17,1575303920,"Republicans have abandoned all their other ""principles"" under Trump so why not abandon their stand against organized labor and corporations over people and vote for this bill? The Democrats simply have to say yes to principles they have long held, Republicans, on the other hand, have to do the right thing for workers - that's the real tough ask here.",103925540,103925540,<br\//>,comment,1575303208,1,False,False,,,103925540,,4,0,[],0,approved,0,1575317401,Haynannu,70016683,Poughkeepsie NY,NULL,NULL
43,18,1575303920,"I'm confused, one minute the article makes it sound like Dems and GOP are worlds apart and next minute it's near completion after hammering out a few final details - wait, isn't that an example of how our democracy is supposed to work?

The Dems will not get hurt by this legislation - if anything they should use it to their advantage.  But again, as usual, they are losing the message battle.  They can be the party of America first by going after deals that help Americans while prosecuting alleged criminals (I only say 'alleged' because the impeachment trial hasn't begun - only the fact finding part is complete, or mostly complete?).",103925559,103925559,<br\//>,comment,1575303272,1,False,False,,,103925559,,2,0,[],0,approved,0,1575305730,Sean,93053777,Chicago,NULL,NULL
44,19,1575303916,"Trump is essentially a 1990's Labor Democrat.

He is skeptical of unfair free trade deals, generally against foreign military intervention, and tough on illegal immigration.

Trump has never changed.

The Democrats did.",103925271,103925271,<br\//>,comment,1575302232,1,False,False,,,103925271,,5,0,[],0,approved,0,1575385369,John,72599185,Pittsburgh/Cologne,NULL,NULL
45,20,1575303916,"Trump will pull this deal or try to change it as soon as the Dems agree to it, just so he can say Democrats ranked it even though he’s the one.

He did it on guns, he’ll do it again on trade.",103925353,103925353,<br\//>,comment,1575302547,1,False,False,,,103925353,,3,0,[],0,approved,0,1575365854,Troy,4040787,Virginia Beach,NULL,NULL
46,21,1575303914,"Another clear victory for President Trump.

No matter what the Democratic House is forced to do by Nancy. 

More reasons he is re-elected.",103925386,103925386,<br\//>,comment,1575302678,1,False,False,,,103925386,,5,0,"[{'commentID': 103926922, 'status': 'approved', 'commentSequence': 103926922, 'userID': 66788641, 'userDisplayName': 'Robert', 'userLocation': 'Out west', 'userTitle': 'NULL', 'userURL': 'NULL', 'picURL': None, 'commentTitle': '<br\\//>', 'commentBody': 'Uh...since it ain’t been passed yet, won’t get passed without further concessions, and already contained a fair amount of leftishness, I’m not really seeing how this is a “clear victory,” for Hizzoner.\n\nCould you explain, please? And please be detailed; a general rant about lib’ruls don’t impress me much.', 'createDate': '1575307707', 'updateDate': '1575341223', 'approveDate': '1575341223', 'recommendations': 0, 'replyCount': 0, 'replies': [], 'editorsSelection': False, 'parentID': 103925386, 'parentUserDisplayName': 'Dr. John', 'depth': 2, 'commentType': 'userReply', 'trusted': 0, 'recommendedFlag': 0, 'permID': '103926922', 'isAnonymous': False}, {'commentID': 103935106, 'status': 'approved', 'commentSequence': 103935106, 'userID': 65739968, 'userDisplayName': 'Frank Opolko', 'userLocation': 'Canada', 'userTitle': 'NULL', 'userURL': 'NULL', 'picURL': None, 'commentTitle': '<br\\//>', 'commentBody': 'Very hard to follow your logic ... trump does things only to distract from what he should be doing... a fraud...', 'createDate': '1575342922', 'updateDate': '1575345094', 'approveDate': '1575345094', 'recommendations': 0, 'replyCount': 0, 'replies': [], 'editorsSelection': False, 'parentID': 103925386, 'parentUserDisplayName': 'Dr. John', 'depth': 2, 'commentType': 'userReply', 'trusted': 0, 'recommendedFlag': 0, 'permID': '103935106', 'isAnonymous': False}]",2,approved,0,1575342403,Dr. John,61584492,Seattle,NULL,NULL
47,22,1575303910,Democrats should consider supporting the agreement on its merits and decouple it from the impeachment inquiry. Please share details of the measure with constituents!,103925168,103925168,<br\//>,comment,1575301875,1,False,False,,,103925168,,2,0,[],0,approved,0,1575306910,Cindy Lelake,32746310,"Anchorage, AK",NULL,NULL
48,23,1575301874,"So, should he be impeached for plagiarizing?",103925140,103925140,<br\//>,comment,1575301778,1,False,False,,,103925140,,2,0,[],0,approved,0,1575305765,Anil Shrivastava,74940280,"Rochester, MI",NULL,NULL
49,24,1575301868,"Lock-in in higher drug prices, sham unions in Mexico that will be overlooked, enforcement lowered.
Tell me how does a car that is not 100% made in the USA avoid a tariff?
This deal stinks.",103924586,103924586,<br\//>,comment,1575299898,1,False,False,,,103924586,,2,0,[],0,approved,0,1575305774,Paulie,60834232,Earth,NULL,NULL
50,0,1575301867,More details please.  And please link to the legislation proposed so we can review it.,103924627,103924627,<br\//>,comment,1575300046,1,False,False,,,103924627,,2,0,[],0,approved,0,1575305778,Mathias,62661042,USA,NULL,NULL
51,1,1575301866,"last time i looked at a map of the world, mexico was part of north american.  have the continents been rearranged?",103924545,103924545,<br\//>,comment,1575299751,1,False,False,,,103924545,,2,0,[],0,approved,0,1575305782,jeff klugman,68194750,"new haven, ct",NULL,NULL
52,2,1575301801,"America First,  defeating Trump Second,
  Nancy, please pass this into law.",103924179,103924179,<br\//>,comment,1575298429,1,False,False,,,103924179,,1,0,[],0,approved,0,1575304311,Ramesh G,48501873,N California,NULL,NULL
53,3,1575301800,"It is my understanding that North America includes Canada, The United States of America, and all the States of Mexico.  Why will the new pact prevent more car manufacturing in Mexico?",103923858,103923858,<br\//>,comment,1575297204,1,False,False,,,103923858,,2,0,[],0,approved,0,1575305795,WSF,72135082,Ann Arbor,NULL,NULL
54,4,1575301799,"We'll see.

Seems like Pelosi is hellbent on making Americans suffer even more while she focuses 100% of her time on Impeachment and 0% of her time on issues that matter most; like improving ACA and signing this trade deal.

By the way..wonder how much progress the House Intelligence Committee is making on protecting our interests with the Iranian Revolution happening right here right now...?

Seems like the IC missed this one too. 

Thankfully Twitter works in Tehran..and the rest of the media world found out.",103924642,103924642,<br\//>,comment,1575300097,1,False,False,,,103924642,,4,0,[],0,approved,0,1575342459,Erica Smythe,72365177,Minnesota,NULL,NULL
55,5,1575301793,It will seriously damage the image of the Democratic Party if they flagrantly refuse to pass legislation which is crystal clear to the American people to be in America's best interest.  That would indeed be putting their vested self political interests ahead that of the people they supposedly serve.  Perhaps a more egregious crime than they will be censuring Trump for.,103924466,103924466,<br\//>,comment,1575299452,1,False,False,,,103924466,,6,0,[],0,approved,0,1575342467,NYer,19888233,New York,NULL,NULL
56,6,1575301792,"Steal? That seems like the wrong word. The article makes clear that both Democrats and Republicans and Mexico had a lot of input in the negotiations of a document that is more than 2000 pages in length. It sounds to me like a “deal”. If Republicans in the Senate pass the bill with a large margin and Democrats in the House refuse to vote on it, Democrats are doomed the next election.",103924744,103924744,<br\//>,comment,1575300444,1,False,False,,,103924744,,5,0,"[{'commentID': 103935178, 'status': 'approved', 'commentSequence': 103935178, 'userID': 65739968, 'userDisplayName': 'Frank Opolko', 'userLocation': 'Canada', 'userTitle': 'NULL', 'userURL': 'NULL', 'picURL': None, 'commentTitle': '<br\\//>', 'commentBody': 'Why do Americans think they and only they design treaties? Without Canada’s Chrystia Freeland, this so-called ‘free trade’ treaty would not be close to acceptable for all participants...', 'createDate': '1575343341', 'updateDate': '1575344428', 'approveDate': '1575344428', 'recommendations': 0, 'replyCount': 0, 'replies': [], 'editorsSelection': False, 'parentID': 103924744, 'parentUserDisplayName': 'John Bowman', 'depth': 2, 'commentType': 'userReply', 'trusted': 0, 'recommendedFlag': 0, 'permID': '103935178', 'isAnonymous': False}]",1,approved,0,1575342482,John Bowman,66293151,Peoria,NULL,NULL
57,7,1575301792,"I agree with Rom and Voter.  Hasn't the Democratic stance all along been that if business can get done in the present impeachment environment, then indeed the people's business is there to be acted on.  Wouldn't everyone welcome, for example, a specific and doable infrastructure plan, even if it came from the President?

Remember that during the absurd attempt to impeach Bill Clinton, the President very conspicuously went about doing his job.  Trump appears to be incapable of separating the people's business from his own, but if he is really behind this plan and it represents an improvement over the status quo ante, why not give it a hearing?  The Democrats would look god-awful if they declared that nothing matters other than impeachment.",103925033,103925033,<br\//>,comment,1575301429,1,False,False,,,103925033,,1,0,[],0,approved,0,1579301785,Out here in Galena,78132446,"Galena, IL",NULL,NULL
58,8,1575301791,"This “dilemma” for Democrats seems contrived by the writer.  If it’s a good pact for their constituents, American workers, they’ll vote for it, as they should and as Ms. Pelosi makes clear.

Republicans, on the other hand, have a different set of constituents - wealthy donors and multinational corporations - which their comments point to.",103924922,103924922,<br\//>,comment,1575301033,1,False,False,,,103924922,,4,0,[],0,approved,0,1575305849,David,61828930,San Jose,NULL,NULL
59,9,1575301784,"As long as there are human hands manipulating this agreement, there will be shortfalls. The GOP, still being an irritant rather than a lubricant is saying this is not us. The Democrats are stunned by cooperation from the right.  Bi-partisanship is a necessity if we are to ever get the Nation’s congressional decision makers to  look out for the country’s best interests. We need agreement by compromise now in the US government to right our politics to good effect.",103924971,103924971,<br\//>,comment,1575301208,1,False,False,,,103924971,https://s3.amazonaws.com/pimage.timespeople.nytimes.com/avatars/cropped-e7616e7125dfd104b24ba0d3a02cacd4fde4324dcc3de0cb24d973609157ebda.jpg,4,0,[],0,approved,0,1575306075,NOTATE REDMOND,75716722,TEJAS,NULL,NULL
60,10,1575301769,"Forget the politics. What we need is fair trade. Haven’t read the proposed deal but if it does not assure fair trade keep negotiating. 

The term free trade is camouflage for multinationals shipping US jobs overseas.",103924649,103924649,<br\//>,comment,1575300115,1,True,False,,,103924649,,34,0,"[{'commentID': 103926082, 'status': 'approved', 'commentSequence': 103926082, 'userID': 73746179, 'userDisplayName': 'Boregard', 'userLocation': 'NYC', 'userTitle': 'NULL', 'userURL': 'NULL', 'picURL': 'https://s3.amazonaws.com/pimage.timespeople.nytimes.com/avatars/cropped-4edced9367278dca2d92f3b4927c25ef2cbf0e4ca698bce6365f03d12fbf1399.jpg', 'commentTitle': '<br\\//>', 'commentBody': ""@Buck \n\nFair trade is also code. Its code for nothing meaningful or concrete. Its code for we have no idea how to define something that has no definable parameters.\n\nWhat is fair trade? And who sets the parameters? How does a small farm compete with an Agricultural-Industrial giant, fairly...? How do you rig the system to get the small farm up with the industrial giant? The small machine shop, say in a minority community, employing non-traditional employees (like minority females) on par with larger, long established ones manned by mostly men, with long established lines of resources?\n\nHow do you help a burgeoning foreign industry to grow, and expand, if you don't give them some advantages in our markets? Or dont curtail the monopolistic tendencies of Big US firms to steam-roll players in small foreign markets?\n\nI think what you mean by fair trade is what Trump thinks. Zero-Sum Gain, all the positives in our direction."", 'createDate': '1575304932', 'updateDate': '1575322713', 'approveDate': '1575306302', 'recommendations': 3, 'replyCount': 0, 'replies': [], 'editorsSelection': False, 'parentID': 103924649, 'parentUserDisplayName': 'Buck', 'depth': 2, 'commentType': 'userReply', 'trusted': 0, 'recommendedFlag': 0, 'permID': '103926082', 'isAnonymous': False}]",1,approved,0,1575363232,Buck,63468193,Flemington,NULL,NULL
61,11,1575301469,"If it's good for the country, Democrats should vote for it.

If it's not, they shouldn't.

Republicans had ample opportunity to participate in creating the Affordable Care Act (Obamacare) in 2009 and 2010, but they flat out refused to participate.

Then, they refused to vote for it.

Now, they continue to try to strike it down even though it helps millions of people, Republican and Democrat, throughout the country.

Democrats, who are strong advocates of good government, need to set an example by supporting good legislation, no matter the party of the President who will sign it. If this turns out to be good, Democrats should pass it.",103925048,103925048,<br\//>,comment,1575301468,1,False,False,,,103925048,,4,0,"[{'commentID': 103925104, 'status': 'approved', 'commentSequence': 103925104, 'userID': 66293151, 'userDisplayName': 'John Bowman', 'userLocation': 'Peoria', 'userTitle': 'NULL', 'userURL': 'NULL', 'picURL': None, 'commentTitle': '<br\\//>', 'commentBody': 'Republicans were not allowed to participate in the over, year long negotiations by Democrats about  whose special interests would be taken care of in the Obamacare law.', 'createDate': '1575301647', 'updateDate': '1575342578', 'approveDate': '1575301798', 'recommendations': 1, 'replyCount': 0, 'replies': [], 'editorsSelection': False, 'parentID': 103925048, 'parentUserDisplayName': 'Barbara T', 'depth': 2, 'commentType': 'userReply', 'trusted': 0, 'recommendedFlag': 0, 'permID': '103925104', 'isAnonymous': False}, {'commentID': 103925771, 'status': 'approved', 'commentSequence': 103925771, 'userID': 52721780, 'userDisplayName': 'Barbara T', 'userLocation': 'Swing State', 'userTitle': 'NULL', 'userURL': 'NULL', 'picURL': None, 'commentTitle': '<br\\//>', 'commentBody': '@John Bowman \n\n""When Democrats passed the Affordable Care Act in 2010 without a single Republican vote, they were criticized for being too partisan. In the end, however, the bill included many Republican ideas.\n\n""The keystone principle of the Act -- a mandate that all Americans buy health insurance -- is rooted in Conservative thinking. Additionally, the Democratic-controlled House and Senate committees adopted nearly 190 Republican amendments while writing the legislation, according to data compiled by the New York Times.""\n\n-- ""Obamacare included Republican ideas, but the GOP Health Plan Has Left Democrats Out"", New York Times, July 21, 2017', 'createDate': '1575303940', 'updateDate': '1575305894', 'approveDate': '1575305392', 'recommendations': 1, 'replyCount': 0, 'replies': [], 'editorsSelection': False, 'parentID': 103925104, 'parentUserDisplayName': 'Barbara T', 'depth': 2, 'commentType': 'userReply', 'trusted': 0, 'recommendedFlag': 0, 'permID': '103925771', 'isAnonymous': False}, {'commentID': 103927004, 'status': 'approved', 'commentSequence': 103927004, 'userID': 66788641, 'userDisplayName': 'Robert', 'userLocation': 'Out west', 'userTitle': 'NULL', 'userURL': 'NULL', 'picURL': None, 'commentTitle': '<br\\//>', 'commentBody': 'That is absolute nonsense, John. And nonsense a lot like the nonsense of yelling that Republicans have been denied the right to cross-examine witnesses and present their evidence in the impeachment hearings.\n\nIt’s not Obama’s fault that you guys couldn’t get your act together, or that you’re devoid of ideas, or that you elected the likes of Louis Gohmert and handed him a megaphone.', 'createDate': '1575307967', 'updateDate': '1575336034', 'approveDate': '1575336034', 'recommendations': 0, 'replyCount': 0, 'replies': [], 'editorsSelection': False, 'parentID': 103925048, 'parentUserDisplayName': 'Barbara T', 'depth': 2, 'commentType': 'userReply', 'trusted': 0, 'recommendedFlag': 0, 'permID': '103927004', 'isAnonymous': False}]",3,approved,0,1575305877,Barbara T,52721780,Swing State,NULL,NULL
62,12,1575300239,"The pact won’t be perfect. Still, it might be heartening to many of the politically war-weary among us if the negotiators can puzzle out the labor piece and declare victory for the greater good.

A moment of political peace on earth might not come amiss.",103924689,103924689,<br\//>,comment,1575300238,1,False,False,,,103924689,,3,0,[],0,approved,0,1575342596,SPM,36937511,VA,NULL,NULL
63,13,1575300237,"Here's a novel idea, Dems for economic growth and prosperity by supporting free trade and open markets.  Time to abandon mercantilism by focusing on what comparative advantages or country still has.  Trumpites are picking up votes from constituencies that were in the past democratic strongholds like unions.   How about Dems tapping into Repub voters by embracing trade policies that make our country competitive rather than protectionist.",103924688,103924688,<br\//>,comment,1575300236,1,False,False,,,103924688,https://s3.amazonaws.com/pimage.timespeople.nytimes.com/avatars/cropped-9bcb7c8dde2fd8c0d896cc118ce12c496b79e409de6c402bdc0ffde7258c4d58.jpg,3,0,[],0,approved,0,1575302918,Mr. Devonic,56783225,wash dc,NULL,NULL
64,14,1575299696,"I'm curious exactly how the proposed deal differs (yes I've seen bits and pieces of how but no details) from the current NAFTA agreement and more to the point how it differs from the Pacific agreement that Trump trashed.  My understanding, right or wrong, is that the proposed agreement is NAFTA modified to look a lot like the trashed Pacific agreement. If so I would like to see some focus on that fact, if correct.",103924457,103924457,<br\//>,comment,1575299414,1,False,False,,,103924457,,0,0,[],0,approved,0,1575299696,FloridaNative,25848769,Tallahassee,NULL,NULL
