,index,approveDate,commentBody,commentID,commentSequence,commentTitle,commentType,createDate,depth,editorsSelection,isAnonymous,parentID,parentUserDisplayName,permID,picURL,recommendations,recommendedFlag,replies,replyCount,status,trusted,updateDate,userDisplayName,userID,userLocation,userTitle,userURL
0,0,1575481764,I love this. Going to share it far and wide.,103966768,103966768,<br\//>,comment,1575481763,1,False,False,,,103966768,,16,0,[],0,approved,0,1577598957,Julie,101917513,New Hampshire,NULL,NULL
1,1,1575481517,"I enjoyed the Mrs. Maisel episodes but I was struck by how out of time the whole schtick was compared to the actual women comics of the 50's and sixties. Women then did not say nasty things about men or their husbands. They said self deprecating things. Phyllis Diller, Carol Burnett, Lucille Ball were the losers being laughed at. Women's lib came into view again in 1972. We have more freedom to speak now, but still can be attacked on race, sex and other uncomfortable topics. 

We all seek to connect except the hermits and they connect sometimes anyway.",103966670,103966670,<br\//>,comment,1575481516,1,False,False,,,103966670,,11,0,[],0,approved,0,1575813472,Michael,21371626,So. CA,NULL,NULL
2,2,1575477676,"Wonderful article!  

Stepping publicly outside of your comfort zone in a creative area can lead to some wonderful outcomes.  You will discover things about yourself and people in general, that you can’t find in other ways. Going out there, in front of an audience, brings out a lot ￼that is both good and bad (but much more of the former).

I’ve done environmental improv acting (taking a character and performing that character amongst other performers and paying audience) for decades, and a lot of the skills I learned there helped me in my regular professions.

Just make sure success is measured internally (did I improve, etc.) and not externally.",103965060,103965060,<br\//>,comment,1575477675,1,False,False,,,103965060,https://s3.amazonaws.com/pimage.timespeople.nytimes.com/avatars/cropped-48d6d89db1d744d15f600cad73334779701f58a51210e6945ec7289b113ee74d.jpg,11,0,[],0,approved,0,1575695043,ASPruyn,76372713,California - Somewhere Left Of Center,NULL,NULL
3,3,1575472710,"Second piece I've read in the Times today about needing to connect.  First, the popular online teenager whose account was closed by Instagram; now the writer who wants to perform comedy.

I have a couple of got to know them first on the WEB friends, but from an e-mail forum from disenfranchised adjunct faculty members (now sort of defunct and I am retired).  I have one friend from the dressing room at Talbot's; another from a trip on a canal boat in France.  

The issue of connection in an era when people eschew religion intrigues me.  Need to connect?  IMO try church, where they really do have to let you in.  (Sometimes, even a nice coffee hour!)",103963047,103963047,<br\//>,comment,1575472709,1,False,False,,,103963047,,3,0,"[{'commentID': 103967518, 'status': 'approved', 'commentSequence': 103967518, 'userID': 56338238, 'userDisplayName': 'cathmary', 'userLocation': 'D/FW Metroplex', 'userTitle': 'NULL', 'userURL': 'NULL', 'picURL': None, 'commentTitle': '<br\\//>', 'commentBody': '@Auntie Mame No, actually, they don\'t necessarily ""let you in"" (at church).  One of the fastest ways to get the cold shoulder from church-going women is to answer ""No"" to the question, ""do you have kids?""  (although why that question is asked of total strangers is beyond me). Ugh.  Such a ""judgey"" place -- church.', 'createDate': '1575483398', 'updateDate': '1576537464', 'approveDate': '1575483399', 'recommendations': 20, 'replyCount': 0, 'replies': [], 'editorsSelection': False, 'parentID': 103963047, 'parentUserDisplayName': 'Auntie Mame', 'depth': 2, 'commentType': 'userReply', 'trusted': 0, 'recommendedFlag': 0, 'permID': '103967518', 'isAnonymous': False}]",1,approved,0,1583040424,Auntie Mame,47931530,NYC,NULL,NULL
4,4,1575458691,"Really interesting/disturbing to see the way race is handled in this piece. Are we to assume that everyone except Sunghi, the comedian ""with dreads,"" and the ""Pakistani-American"" landlord are white? Because that's the norm? And the rest of us need racial markers (because we are outside the norm?). What was the landlord's response? Why does Mrs. Sohn choose to exclude it? Is she uncomfortable because of her own biases, perhaps?",103954777,103954777,<br\//>,comment,1575418202,1,False,False,,,103954777,,9,0,"[{'commentID': 103964081, 'status': 'approved', 'commentSequence': 103964081, 'userID': 65728523, 'userDisplayName': 'Richard', 'userLocation': 'New York City', 'userTitle': 'NULL', 'userURL': 'NULL', 'picURL': None, 'commentTitle': '<br\\//>', 'commentBody': ""@Randall \n\nI saw the set--the landlord's background (as a Muslim woman) was relevant because the joke was about secularism. Ms. Sohn was being self-deprecating (and charming). If you want to hear the entire joke, you can go see her perform."", 'createDate': '1575475300', 'updateDate': '1576998078', 'approveDate': '1575476588', 'recommendations': 27, 'replyCount': 0, 'replies': [], 'editorsSelection': False, 'parentID': 103954777, 'parentUserDisplayName': 'Randall', 'depth': 2, 'commentType': 'userReply', 'trusted': 0, 'recommendedFlag': 0, 'permID': '103964081', 'isAnonymous': False}, {'commentID': 103962535, 'status': 'approved', 'commentSequence': 103962535, 'userID': 63500310, 'userDisplayName': 'mark', 'userLocation': 'NYC', 'userTitle': 'NULL', 'userURL': 'NULL', 'picURL': None, 'commentTitle': '<br\\//>', 'commentBody': '@Randall - lighten up.', 'createDate': '1575471632', 'updateDate': '1575692405', 'approveDate': '1575476596', 'recommendations': 17, 'replyCount': 0, 'replies': [], 'editorsSelection': False, 'parentID': 103954777, 'parentUserDisplayName': 'Randall', 'depth': 2, 'commentType': 'userReply', 'trusted': 0, 'recommendedFlag': 0, 'permID': '103962535', 'isAnonymous': False}, {'commentID': 103965808, 'status': 'approved', 'commentSequence': 103965808, 'userID': 77860739, 'userDisplayName': 'Deborah', 'userLocation': 'hawthorne', 'userTitle': 'NULL', 'userURL': 'NULL', 'picURL': None, 'commentTitle': '<br\\//>', 'commentBody': 'the issue of reace stood out for me as well. in the article. with your comment,  I realize what there problem was: assumption of whiteness, unless otherwise noted...', 'createDate': '1575479455', 'updateDate': '1575923712', 'approveDate': '1575479456', 'recommendations': 6, 'replyCount': 0, 'replies': [], 'editorsSelection': False, 'parentID': 103954777, 'parentUserDisplayName': 'Randall', 'depth': 2, 'commentType': 'userReply', 'trusted': 0, 'recommendedFlag': 0, 'permID': '103965808', 'isAnonymous': False}]",3,approved,0,1575761045,Randall,38765230,Brooklyn,NULL,NULL
5,5,1575458687,Having experienced it second hand - sometimes that old movie cliché that you only feel really happy and alive when you are on stage is true.,103958622,103958622,<br\//>,comment,1575444995,1,False,False,,,103958622,,2,0,[],0,approved,0,1575561204,Milliband,19111801,Medford,NULL,NULL
6,6,1575439600,"I have always thought stand up comedy must be the most difficult performing art. No one to fall back on, and no amount of prep can guarantee a good set. Humor is so subjective and idiosyncratic. I really admire those who do it well.",103958298,103958298,<br\//>,comment,1575439599,1,False,False,,,103958298,,29,0,[],0,approved,0,1575753259,Pde,60769564,Here,NULL,NULL
7,7,1575436909,You rock.,103956188,103956188,<br\//>,comment,1575424843,1,False,False,,,103956188,https://s3.amazonaws.com/pimage.timespeople.nytimes.com/avatars/cropped-5b283102e5f9ba62046eaf6a3f6ef98e44ba7ff630ca1a4e55af8534409ffe1d.jpg,7,0,[],0,approved,0,1575986529,Richard McNally,58305593,Watertown MA,NULL,NULL
8,8,1575416995,One is the loneliest number. We humans are social animals. We all need community.,103953422,103953422,<br\//>,comment,1575412988,1,False,False,,,103953422,,11,0,[],0,approved,0,1575753266,billd,56749336,Colorado Springs,NULL,NULL
9,9,1575416994,"A few hundred years ago, a pal of mine moved to L.A. to do standup. It was a struggle. He wasn't breaking out. Johnny Carson wasn't calling his agent.

One night a man came backstage and said to him, ""You're not gonna make it as a standup comic, but you can write gags, so write for my show."" He left my friend his business card.

My pal wrote for the man's show, and for many other shows. He made a great career writing funny lines for other people to speak.

Just to say, You can't hit the ball unless you swing at the ball. So keep swinging, kiddo. I admire your spunk.",103950669,103950669,<br\//>,comment,1575404962,1,False,False,,,103950669,,43,0,"[{'commentID': 103967156, 'status': 'approved', 'commentSequence': 103967156, 'userID': 61308123, 'userDisplayName': 'Hélène B.', 'userLocation': 'NYC', 'userTitle': 'NULL', 'userURL': 'NULL', 'picURL': None, 'commentTitle': '<br\\//>', 'commentBody': 'But being on stage is what keeps her going...', 'createDate': '1575482617', 'updateDate': '1575753302', 'approveDate': '1575484632', 'recommendations': 3, 'replyCount': 0, 'replies': [], 'editorsSelection': False, 'parentID': 103950669, 'parentUserDisplayName': 'Taz', 'depth': 2, 'commentType': 'userReply', 'trusted': 0, 'recommendedFlag': 0, 'permID': '103967156', 'isAnonymous': False}]",1,approved,0,1575736439,Taz,57556769,NYC,NULL,NULL
10,10,1575416991,Why do folks just coming out of a break-up bounce off immediately to dating again? I don' t understand it.,103951382,103951382,<br\//>,comment,1575406463,1,False,False,,,103951382,,8,0,"[{'commentID': 103955435, 'status': 'approved', 'commentSequence': 103955435, 'userID': 55302446, 'userDisplayName': 'Peggy', 'userLocation': 'Colorado', 'userTitle': 'NULL', 'userURL': 'NULL', 'picURL': 'https://s3.amazonaws.com/pimage.timespeople.nytimes.com/avatars/cropped-29ff2c6dc85972d4530f3edeb6ca7efeb4ebf4d45ff5d40a9c0b988433c6cce7.jpg', 'commentTitle': '<br\\//>', 'commentBody': ""@Sharon M I'm with you. As a divorce lawyer I tell my folks to wait at least a year to start dating or they will be back to see me again. They never believe me, and sure enough I do their second divorce two years after their first."", 'createDate': '1575421222', 'updateDate': '1576537497', 'approveDate': '1575421223', 'recommendations': 28, 'replyCount': 0, 'replies': [], 'editorsSelection': False, 'parentID': 103951382, 'parentUserDisplayName': 'Sharon M', 'depth': 2, 'commentType': 'userReply', 'trusted': 0, 'recommendedFlag': 0, 'permID': '103955435', 'isAnonymous': False}, {'commentID': 103965023, 'status': 'approved', 'commentSequence': 103965023, 'userID': 88010699, 'userDisplayName': 'Tom', 'userLocation': 'Tar Beach', 'userTitle': 'NULL', 'userURL': 'NULL', 'picURL': None, 'commentTitle': '<br\\//>', 'commentBody': ""@Sharon M I'm so glad that I'm not the only one to pick up on that. I've been single for years & I can't wrap my brain around people NOT being able to be NOT dating. Sure, I get horribly lonely at times, but, the organic feeling(s) of being alone & not having someone special in life, sometimes offer an amazing & powerful opportunity to grow & to get to know myself. Sheesh."", 'createDate': '1575477584', 'updateDate': '1575813681', 'approveDate': '1575481742', 'recommendations': 7, 'replyCount': 0, 'replies': [], 'editorsSelection': False, 'parentID': 103951382, 'parentUserDisplayName': 'Sharon M', 'depth': 2, 'commentType': 'userReply', 'trusted': 0, 'recommendedFlag': 0, 'permID': '103965023', 'isAnonymous': False}]",2,approved,0,1580765247,Sharon M,16992486,Seattle,NULL,NULL
11,11,1575416989,Well now I want to listen to your set!,103952907,103952907,<br\//>,comment,1575411347,1,False,False,,,103952907,,14,0,[],0,approved,0,1575986548,rebekah calano,66936424,chicago,NULL,NULL
12,12,1575416987,"Growth is the only sign of life.
Good on ya, Ms. Sohn.",103947144,103947144,<br\//>,comment,1575396858,1,False,False,,,103947144,,15,0,[],0,approved,0,1575753356,Zeke27,60584176,New York,NULL,NULL
13,13,1575416987,Amy: Your article moves me to patronize open mics to encourage new comedians. How does one find open mic venues?,103948793,103948793,<br\//>,comment,1575400355,1,False,False,,,103948793,https://s3.amazonaws.com/pimage.timespeople.nytimes.com/avatars/cropped-611633ec31de872e6308b7fe0bc11b7493d4224d34513d33ba2fba215f7257ca.jpg,5,0,"[{'commentID': 103958847, 'status': 'approved', 'commentSequence': 103958847, 'userID': 60684155, 'userDisplayName': 'mikeginn', 'userLocation': 'CA', 'userTitle': 'NULL', 'userURL': 'NULL', 'picURL': None, 'commentTitle': '<br\\//>', 'commentBody': '@Molly Bloom badslava dot com is one good attempt at a list', 'createDate': '1575450516', 'updateDate': '1575612697', 'approveDate': '1575458419', 'recommendations': 1, 'replyCount': 0, 'replies': [], 'editorsSelection': False, 'parentID': 103948793, 'parentUserDisplayName': 'Molly Bloom', 'depth': 2, 'commentType': 'userReply', 'trusted': 0, 'recommendedFlag': 0, 'permID': '103958847', 'isAnonymous': False}]",1,approved,0,1575509941,Molly Bloom,6044548,Tri State,NULL,NULL
14,14,1575416987,Cheaper than therapy and just as humiliating.,103953631,103953631,<br\//>,comment,1575413616,1,False,False,,,103953631,https://s3.amazonaws.com/pimage.timespeople.nytimes.com/avatars/cropped-784d0cc44b0ad0a68d99b997c187233b8da979b86460c3e131ddf0dec62547d8.jpg,32,0,[],0,approved,0,1575988227,Mel,4389605,Dallas,NULL,NULL
15,15,1575416985,Keep on keeping on!,103948303,103948303,<br\//>,comment,1575399231,1,False,False,,,103948303,,2,0,[],0,approved,0,1575499586,James luce,35054389,Vancouver Wa,NULL,NULL
16,16,1575416985,"Awesome op-ed. Keep writing, keep performing.",103948951,103948951,<br\//>,comment,1575400726,1,False,False,,,103948951,,10,0,[],0,approved,0,1575509884,CL,17282,Paris,NULL,NULL
17,17,1575416985,So ... what was the line?,103949405,103949405,<br\//>,comment,1575401741,1,False,False,,,103949405,,6,0,[],0,approved,0,1575986565,Bill,11705772,New York,NULL,NULL
18,18,1575416984,Loved this piece.  How about a joke or two to hook us into coming?  Can't hurt.,103948899,103948899,<br\//>,comment,1575400586,1,False,False,,,103948899,,10,0,[],0,approved,0,1575509878,follow the money,53930323,"Litchfield County, Ct.",NULL,NULL
19,19,1575416982,rooting for you!,103949277,103949277,<br\//>,comment,1575401459,1,False,False,,,103949277,,6,0,[],0,approved,0,1575495847,LPR,78153500,pacific northwest,NULL,NULL
20,20,1575416979,"Well done, you!",103948347,103948347,<br\//>,comment,1575399317,1,False,False,,,103948347,,6,0,[],0,approved,0,1575511806,gracie,55190207,New York,NULL,NULL
21,21,1575416974,"maybe rickles....... hysterical but fear inducing. particularly when talking about sex life jokes, etc.  sometimes joke telling is risky in its intimacy. 


it wasn't mentioned, but my fear ( if i was a female comic in these venues)  would be getting hit on by a bunch of sleazy guys.  particularly with so much drinking involved.",103950246,103950246,<br\//>,comment,1575403886,1,False,False,,,103950246,,2,0,[],0,approved,0,1575660006,dw,81345027,Boston,NULL,NULL
22,22,1575416974,"I do wish you the best of luck in your comedic turns.  You are braver than I.

(And I am shocked, *shocked* that the men you've been dating have been taking Viagra right in front of you.  They should do it the old-fashioned way: privately in the bathroom, snorted using a lucky $2 bill inherited from his grandfather--like God intended)

(**please do not actually take Viagra this way)",103951527,103951527,<br\//>,comment,1575406860,1,False,False,,,103951527,https://s3.amazonaws.com/pimage.timespeople.nytimes.com/avatars/cropped-0ebdda6536cdc917e9c662ad1e47f5255e1d653e2f1a9e0739e18949bb97bc3e.jpg,10,0,[],0,approved,0,1575813149,Jacob Sommer,54874472,"Medford, MA",NULL,NULL
23,23,1575413330,Loved this! Best wishes for a funny future. We'll be waiting.,103953534,103953534,<br\//>,comment,1575413329,1,False,False,,,103953534,,15,0,[],0,approved,0,1575509853,Alice,88056874,NJ,NULL,NULL
24,24,1575410834,"This is one of the most real, relatable stories I've read in the NYT in quite a long time. And I'm not divorced or Jewish or  New Yorker. Amy Sohn's writing and humor seem to transcend labels and speak to the human soul. Thank you for sharing your humor -- and your story.",103952769,103952769,<br\//>,comment,1575410833,1,False,False,,,103952769,,38,0,[],0,approved,0,1576998296,Rose,5447187,Seattle,NULL,NULL
25,0,1575408287,"Geez,  you thought you were funny but you brought me to tears.  There’s something about rising up to confront vulnerability that always inspires.   The world needs more transparency and nobody does that better than comedians.  Thanks for the joyful ending.",103951982,103951982,<br\//>,comment,1575408286,1,False,False,,,103951982,,32,0,[],0,approved,0,1575642030,David E,1933668,"Boston, Ma",NULL,NULL
26,1,1575407460,"Extremely inspired! Life is meant to be enjoyed, so why not have fun?",103951709,103951709,<br\//>,comment,1575407460,1,False,False,,,103951709,,16,0,[],0,approved,0,1575499692,Lauren,83345395,BK NY,NULL,NULL
27,2,1575404806,"The writer keeps likening herself to Mrs. Maisel, but that character ignored and neglected her children to the point of abuse. I couldn’t get past the narcissism, immaturity and selfishness of the not so marvelous Mrs. Maisel. Or the disturbing ethnic stereo types in the show. I stopped watching before her career really took off. 

Not a good role model.",103947637,103947637,<br\//>,comment,1575397999,1,False,False,,,103947637,https://s3.amazonaws.com/pimage.timespeople.nytimes.com/avatars/cropped-666968de9cbd0f4b8b5878a17da15ae01bce67176845662fbeb19d5d26b8abfe.jpg,17,0,"[{'commentID': 103951219, 'status': 'approved', 'commentSequence': 103951219, 'userID': 18886791, 'userDisplayName': 'SS', 'userLocation': 'California', 'userTitle': 'NULL', 'userURL': 'NULL', 'picURL': None, 'commentTitle': '<br\\//>', 'commentBody': ""@Passion for Peaches \nThanks for putting into words my intuitions.I only watched a few episodes so I couldn't quite articulate why I didn't like it. But it definitely made me uncomfortable."", 'createDate': '1575406087', 'updateDate': '1575519608', 'approveDate': '1575406087', 'recommendations': 8, 'replyCount': 0, 'replies': [], 'editorsSelection': False, 'parentID': 103947637, 'parentUserDisplayName': 'Passion for Peaches', 'depth': 2, 'commentType': 'userReply', 'trusted': 0, 'recommendedFlag': 0, 'permID': '103951219', 'isAnonymous': False}, {'commentID': 103951239, 'status': 'approved', 'commentSequence': 103951239, 'userID': 100122774, 'userDisplayName': 'Tom Jones', 'userLocation': 'Austin, TX', 'userTitle': 'NULL', 'userURL': 'NULL', 'picURL': None, 'commentTitle': '<br\\//>', 'commentBody': '@Passion for Peaches   I think the children here were simply a plot device. Obviously her after marriage situation would have been totally different without children as a factor. The comedy was about her, not the children.  I inhaled the whole series and I thought it and the period aspect was fantastic!', 'createDate': '1575406121', 'updateDate': '1585542216', 'approveDate': '1575406121', 'recommendations': 24, 'replyCount': 0, 'replies': [], 'editorsSelection': False, 'parentID': 103947637, 'parentUserDisplayName': 'Passion for Peaches', 'depth': 2, 'commentType': 'userReply', 'trusted': 0, 'recommendedFlag': 0, 'permID': '103951239', 'isAnonymous': False}, {'commentID': 103952160, 'status': 'approved', 'commentSequence': 103952160, 'userID': 76268538, 'userDisplayName': 'Terri McFadden', 'userLocation': 'Massachusetts', 'userTitle': 'NULL', 'userURL': 'NULL', 'picURL': None, 'commentTitle': '<br\\//>', 'commentBody': '@Passion for Peaches Interesting comment. Although I loved Mrs. Maisel and am looking forward to seeing the next installments, I too was uncomfortable with her behavior (or lack thereof) with her children. However, then I thought about if Mr. Maisel had been a sucessful comic, left the kids with his wife or mother and gone off to clubs, would we be uncomfortable or angry with him. Her mother is taking care of the kids. Let Mrs. Maisel fly, I say!', 'createDate': '1575408847', 'updateDate': '1575659890', 'approveDate': '1575408848', 'recommendations': 41, 'replyCount': 0, 'replies': [], 'editorsSelection': False, 'parentID': 103947637, 'parentUserDisplayName': 'Passion for Peaches', 'depth': 2, 'commentType': 'userReply', 'trusted': 0, 'recommendedFlag': 0, 'permID': '103952160', 'isAnonymous': False}]",7,approved,0,1575761184,Passion for Peaches,49716641,Left Coast,NULL,NULL
28,3,1575404806,"Love this! So nice to read these real issues and how Amy Sohn is dealing with them. 

One thing that confused me. She says ""last month"" she went to her first open mic at EastVille but the series of events after that seem to have taken place over more than a month. Is this really only a month?",103947836,103947836,<br\//>,comment,1575398346,1,False,False,,,103947836,,0,0,[],0,approved,0,1575410609,Betsy M,22770605,"Albany, CA",NULL,NULL
29,4,1575404806,"Keep working, keep writing!  Oh, that was my own joke!  I find you so brave for going outside of your comfort zone, which certainly became suddenly uncomfortable!  I love ""Mrs. Maisel"" for the same reason.  I hope to see your act sometime, but I suspect you'll get alot out of it even if you don't hit it big!  You're already a success!",103948054,103948054,<br\//>,comment,1575398709,1,False,False,,,103948054,,14,0,[],0,approved,0,1575499811,Joe L.,5557243,Long Island,NULL,NULL
30,5,1575404806,Loved this.,103948118,103948118,<br\//>,comment,1575398831,1,False,False,,,103948118,,10,0,[],0,approved,0,1575509871,ABG,82848754,MA,NULL,NULL
31,6,1575404806,"Congrats and kudos to you, this seems to fit right into what Jerry Seinfeld and Eddie Murphy said on Comedians....",103948344,103948344,<br\//>,comment,1575399315,1,False,False,,,103948344,,8,0,[],0,approved,0,1575499821,BertilP,1968120,Harlem,NULL,NULL
32,7,1575404806,Keep going Amy ! See you on Amazon ( hint: more mature comedy than Netflix !),103948405,103948405,<br\//>,comment,1575399456,1,False,False,,,103948405,,9,0,[],0,approved,0,1575509900,Richard Kaufman,34633341,Los Angeles,NULL,NULL
33,8,1575404806,She is far funnier than the show,103948443,103948443,<br\//>,comment,1575399555,1,False,False,,,103948443,,6,0,[],0,approved,0,1575499838,Roger,81390811,Cuba,NULL,NULL
34,9,1575404806,I can't tell which is lovelier; the article or the person who wrote it.,103949831,103949831,<br\//>,comment,1575402830,1,False,False,,,103949831,,22,0,[],0,approved,0,1575510032,rocky vermont,55233316,vermont,NULL,NULL
35,10,1575401919,"2 February's ago I visited NYC with my then 21 year-old daughter, staying in an AirBNB on the LES.  
We went to Old Man Hustle for an open mic night.  When we walked in  the bartender in this smallest club ever asked if I wanted on the list . . . that's how we found out it was an open mic night!
A few dreadful, a few ok-ish, a few funny, at least one was hilarious.  All them courageous, including the bartender!
While my daughter and I sat and chatted at the bar, I said, ""I could do 20 minutes on your my mother, but I can't do the first minute"".  Over my daughter's shoulder I saw an eavesdropper's knowing nod.  
After Amy's story, I am compelled to try at least for the first five.",103949470,103949470,<br\//>,comment,1575401916,1,False,False,,,103949470,,34,0,[],0,approved,0,1575736488,Ted,67076752,"London, Ontario, CANADA",NULL,NULL
36,11,1575401556,"Hi Amy,  Bravo for this piece, for your bravery, and for your encouragement.  You made my whole day!",103949322,103949322,<br\//>,comment,1575401556,1,False,False,,,103949322,,23,0,[],0,approved,0,1575499902,Brooke,26755251,NYC,NULL,NULL
37,12,1575401551,"Comics turn terrible into funny. ""Just give it some time, kid. If you survive, it'll be a joke someday."" Is this because human existence is inherently funny but we can't see the joke when we are standing in the middle of it? I dunno. Think I'll go ask Samuel Becket. Or some other infinite jester.

The line about getting married, then divorced so the comic could come up with a good joke reflects the reality that they have to live through bad things to use them for material. Really bad things, better jokes. No wonder comics are off balance, they look for the bad in life and hug it till it starts laughing.",103949316,103949316,<br\//>,comment,1575401549,1,False,False,,,103949316,https://s3.amazonaws.com/pimage.timespeople.nytimes.com/avatars/cropped-2add06ad60a566fc16ca6fab796628cba96955a52a7cb730da1129830356a7cb.jpg,33,0,"[{'commentID': 103962847, 'status': 'approved', 'commentSequence': 103962847, 'userID': 60834232, 'userDisplayName': 'Paulie', 'userLocation': 'Earth', 'userTitle': 'NULL', 'userURL': 'NULL', 'picURL': None, 'commentTitle': '<br\\//>', 'commentBody': '@Doug Terry this is exactly why the kids of rich people are bores, never having to face any strife in their lives. I know a few and not one has a funny story to tell.', 'createDate': '1575472325', 'updateDate': '1575768053', 'approveDate': '1575476575', 'recommendations': 3, 'replyCount': 0, 'replies': [], 'editorsSelection': False, 'parentID': 103949316, 'parentUserDisplayName': 'Doug Terry', 'depth': 2, 'commentType': 'userReply', 'trusted': 0, 'recommendedFlag': 0, 'permID': '103962847', 'isAnonymous': False}]",1,approved,0,1575960519,Doug Terry,65455323,"Maryland, Washington DC metro",NULL,NULL
38,13,1575401416,absolutely brilliant!  Courage and determination for renewal that all of us in the same situation hope for.,103949254,103949254,<br\//>,comment,1575401413,1,False,False,,,103949254,,22,0,[],0,approved,0,1575514466,alocksley,66132793,NYC,NULL,NULL
