,index,approveDate,commentBody,commentID,commentSequence,commentTitle,commentType,createDate,depth,editorsSelection,isAnonymous,parentID,parentUserDisplayName,permID,picURL,recommendations,recommendedFlag,replies,replyCount,status,trusted,updateDate,userDisplayName,userID,userLocation,userTitle,userURL
33,8,1575252903,so he watched the military channel and now he can overturn centuries of military expertise? What an immense ego.,103919925,103919925,<br\//>,comment,1575249019,1,False,False,,,103919925,,26,0,[],0,approved,0,1575292453,Lady Di,56785944,Central Florida,NULL,NULL
34,9,1575252903,"Trump is creating a new ethos in the military where it is not only permissible to be lawless, but it is honored.  Further, he is creating pockets of military personnel who have personal loyalty to him, instead of the chain of command.  Both developments should strike US citizens with grave concern.",103920070,103920070,<br\//>,comment,1575250490,1,False,False,,,103920070,,45,0,[],0,approved,0,1575335175,Norm Whitton,75732176,Houston,NULL,NULL
35,10,1575252903,"Gallagher deserves to lose his pension and face military discipline, including imprisonment for executing a sedated captive. What he did was a war crime, no better than the brutality ISIS fighters wreaked on their captives. He comes across more as someone more interested in legitimatized killing, than in pursuing a honorable career in the SEALS. And Trump is holding him up as a role model. 

Interfering with military discipline to deflect from  his Ukrainian problem, and to once again show his contempt for the rule of any law, from Constitutional to civil and military,  Donald Trump once again proves himself an unqualified, unfit Commander in Chief. His attacks on the Intelligence Community, the FBI and now, the autonomy of the military to police their own should alarm every American.",103920188,103920188,<br\//>,comment,1575251687,1,False,False,,,103920188,,33,0,[],0,approved,0,1575600669,Patricia,65412564,NY,NULL,NULL
36,11,1575252903,"There is no right or ethical standard at this point. Just a draft dogging bully with the power to excuse someone who is as ethically and legally challenged as he is. Trumps goal is to debase every institution and person to the point where no one could pick him out of a line up of the worse of the most unethical or illegal players. 

There are two America’s now. I cling to the one where truth and character matters. Where the ends don’t justify the means. The other is the party of trump where lying isn’t even considered an issue. The TOP’s (tump Owns Party) have dispensed with any red lines, whether they are deficits, tariffs, legality, truth, corruption, colluding with a foreign government, Turing against allies. They have made  A pack with the Devil, but not to worry they don’t have souls at this point.",103920228,103920228,<br\//>,comment,1575252088,1,False,False,,,103920228,,18,0,[],0,approved,0,1575298705,GS,64778339,Brooklyn,NULL,NULL
37,12,1575252903,"All these “pro-military” Trump supporters seem to misunderstand the position of commander-in-chief. Being at the top of the chain of command still means you are part of that chain of command, and like any part of the chain of command the commander-in-chief should respect military discipline and the system of military justice. The US military does not turn into another wholly-owned Trump subsidiary just because he is president.",103920281,103920281,<br\//>,comment,1575252743,1,False,False,,,103920281,,19,0,"[{'commentID': 103921181, 'status': 'approved', 'commentSequence': 103921181, 'userID': 86840485, 'userDisplayName': 'Me', 'userLocation': 'Ger', 'userTitle': 'NULL', 'userURL': 'NULL', 'picURL': None, 'commentTitle': '<br\\//>', 'commentBody': 'Apparently it does. How utterly frightening.', 'createDate': '1575268190', 'updateDate': '1575302899', 'approveDate': '1575281142', 'recommendations': 1, 'replyCount': 0, 'replies': [], 'editorsSelection': False, 'parentID': 103920281, 'parentUserDisplayName': 'citybumpkin', 'depth': 2, 'commentType': 'userReply', 'trusted': 0, 'recommendedFlag': 0, 'permID': '103921181', 'isAnonymous': False}]",1,approved,0,1575321165,citybumpkin,60909833,Earth,NULL,NULL
38,13,1575252869,"For several years I worked in mental health with the VA. The Gallagher case may seem extreme but I’ve heard dozens of similar tales from Veterans from WW2 to recent years. Many who served alongside (eventually) speak about it or report it. Most don’t. 

They know they’ll be unsupported by the team if they do. That “accidental” friendly fire and fragging are real. As are thousands of sexual assaults and rape annually of  male and female service members—those too are “investigated” by insiders. 

Most Veterans I knew just tried to get through their 4 years and then quit. Elite units and officer corps are atypical—especially in their willingness to cover up for guys like Gallagher. He’s not as rare as you’d think. 

Ask any therapist who’s worked with Veterans or active duty military. We hear the tortured laments of powerless enlisted ranks who struggled with reporting, and decided the truth would not set them free but more likely get them killed, often decades later. That 6 (of 22 in the platoon, not a high percentage) spoke up about Gallagher is heartening. That others tried to agree on how to play this is much more common.",103920211,103920211,<br\//>,comment,1575251944,1,True,False,,,103920211,,146,0,[],0,approved,0,1587871698,Huh,66348272,Upstate,NULL,NULL
39,14,1575252824,Trump attracts the very worst elements in the military such as Michael Flynn and Gallagher.   Trump dishonors all Americans and appears to work to destroy this country and its institutions.  All roads lead to Putin.,103920140,103920140,<br\//>,comment,1575251155,1,False,False,,,103920140,,16,0,[],0,approved,0,1575337553,Kathryn Aguilar,69505538,"Houston, Tx",NULL,NULL
40,15,1575251424,"I just saw a promo for a new war series on cable and oddly, it left me with a feeling of disgust. I didn't pick up on the premise of  whether it's suppose to be funny or serious but after reading about the alleged murderous acts of a ""war hero"", maybe it's time for the networks give an increasingly war-weary population some rest.",103919924,103919924,<br\//>,comment,1575249003,1,False,False,,,103919924,,13,0,[],0,approved,0,1575335299,carlo1,57323092,"Wichita, KS",NULL,NULL
41,16,1575251416,"Early in Mr Trump's presidency, he was openly bigoted and derogatory to former military men, and he appeared proud all the while.  

Now he is currying favor from military, or at least he acts as though he believes he is currying favor.   Many of them, with discipline ingrained, believe his behavior is unfavorable.  

I am concerned.  Why would he need the support of the military soon ?    

He is about to be impeached and he neither understands nor obeys, protects, or defends the United States Constitution.  More than one person has spoken of the possibility that he will refuse to leave the White House when it is his time to go.   Aah, then, suddenly, all military are his friends.    I get it.   

""Bone Spurs, begone with thee!   I am actually a good friend of our military.   As I shall soon need them.""",103920043,103920043,<br\//>,comment,1575250162,1,False,False,,,103920043,,19,0,[],0,approved,0,1575298833,Thinker,27678736,Upstate NY,NULL,NULL
42,17,1575251375,"Trump’s affinity for Gallagher is completely understandable:  lethal, all-powerful, exultant in triumphant cruelty over a helpless foe, Gallagher is exactly what Trump dreams of being himself.",103919845,103919845,<br\//>,comment,1575248151,1,False,False,,,103919845,,23,0,[],0,approved,0,1575321205,Jurretta,1742829,Live in VA. Work in DC.,NULL,NULL
43,18,1575251348,"I don’t understand how he thinks he is defending the military or its warriors. What about the other SEALs who spoke out against Gallagher? Are they not warriors? What about Gallagher’s superiors? This seems like a defense of misconduct (putting it lightly; I’m too tired of the blunt truth sounding like hyperbole, as it usually does these days). Not a defense of a warrior.",103919008,103919008,<br\//>,comment,1575240351,1,True,False,,,103919008,,160,0,[],0,approved,0,1577607680,Kathy,73757579,California,NULL,NULL
44,19,1575251316,"Tests Pentagons tolerance? I seem to remember from 7th grade civics that the President is the Pentagon's boss. So when the Pentagon reaches the limit of it's tolerance, what are they supposedly going to do?",103920063,103920063,<br\//>,comment,1575250439,1,True,False,,,103920063,,18,0,"[{'commentID': 103920245, 'status': 'approved', 'commentSequence': 103920245, 'userID': 68956254, 'userDisplayName': 'bobandholly', 'userLocation': 'NYC', 'userTitle': 'NULL', 'userURL': 'NULL', 'picURL': None, 'commentTitle': '<br\\//>', 'commentBody': '@John Donovan  There’s not enough support in the rank and file for staging a coup against trump', 'createDate': '1575252331', 'updateDate': '1577607696', 'approveDate': '1575256229', 'recommendations': 5, 'replyCount': 0, 'replies': [], 'editorsSelection': False, 'parentID': 103920063, 'parentUserDisplayName': 'John Donovan', 'depth': 2, 'commentType': 'userReply', 'trusted': 0, 'recommendedFlag': 0, 'permID': '103920245', 'isAnonymous': False}, {'commentID': 103920519, 'status': 'approved', 'commentSequence': 103920519, 'userID': 39918670, 'userDisplayName': 'Brad', 'userLocation': 'Chester, NJ', 'userTitle': 'NULL', 'userURL': 'NULL', 'picURL': 'https://s3.amazonaws.com/pimage.timespeople.nytimes.com/avatars/cropped-cbff29f716336aeccd52e94d544ebb92c1cca17eaf2f8bf88706bd0e0ba6b618.jpg', 'commentTitle': '<br\\//>', 'commentBody': '@John Donovan Remove him from power. It’s about time.', 'createDate': '1575255517', 'updateDate': '1577607699', 'approveDate': '1575256231', 'recommendations': 9, 'replyCount': 0, 'replies': [], 'editorsSelection': False, 'parentID': 103920063, 'parentUserDisplayName': 'John Donovan', 'depth': 2, 'commentType': 'userReply', 'trusted': 0, 'recommendedFlag': 0, 'permID': '103920519', 'isAnonymous': False}, {'commentID': 103920453, 'status': 'approved', 'commentSequence': 103920453, 'userID': 85682496, 'userDisplayName': 'Randall', 'userLocation': 'Portland, OR', 'userTitle': 'NULL', 'userURL': 'NULL', 'picURL': None, 'commentTitle': '<br\\//>', 'commentBody': '@John Donovan I dunno: follow the Constitution, rather than the President, would be my guess. Part of the oath you take when you enlist is to defend the country against all enemies, foreign and domestic, and Trump is an enemy of America.', 'createDate': '1575254656', 'updateDate': '1577607707', 'approveDate': '1575256233', 'recommendations': 45, 'replyCount': 0, 'replies': [], 'editorsSelection': False, 'parentID': 103920063, 'parentUserDisplayName': 'John Donovan', 'depth': 2, 'commentType': 'userReply', 'trusted': 0, 'recommendedFlag': 0, 'permID': '103920453', 'isAnonymous': False}]",7,approved,0,1577607689,John Donovan,60174480,"Plano,Texas",NULL,NULL
45,20,1575251297,"L'affaire Gallagher indeed raises a more profound disturbing issue. 

As Presidential candidate and after becoming the President Trump daringly exhibited clownish behaviour repeatedly. How on earth did the American people elect such a non intellect as a President? Is this an indication of the average American's intellect?

It indeed speaks about ignorance and denial of reality and inability to live in a changing world, unwilling to make the changes essential to thrive in a new world. Most voters are in denial and unable to see that China is taking over, and prefer to hear lies that make them of being still '#1' rather than acknowledge the need to work, invest in education, science, technology, infrastructure, medicine, world peace etc to remain dominant. 

Instead of looking outwards optimistically of the future, the US is looking inwards!",103919944,103919944,<br\//>,comment,1575249168,1,False,False,,,103919944,,15,0,"[{'commentID': 103920175, 'status': 'approved', 'commentSequence': 103920175, 'userID': 54563906, 'userDisplayName': 'Sumac', 'userLocation': 'Michigan', 'userTitle': 'NULL', 'userURL': 'NULL', 'picURL': None, 'commentTitle': '<br\\//>', 'commentBody': 'Yes, I do believe that this is an indicator of the average Americans intellect.', 'createDate': '1575251526', 'updateDate': '1575298907', 'approveDate': '1575252903', 'recommendations': 6, 'replyCount': 0, 'replies': [], 'editorsSelection': False, 'parentID': 103919944, 'parentUserDisplayName': 'N.G Krishnan', 'depth': 2, 'commentType': 'userReply', 'trusted': 0, 'recommendedFlag': 0, 'permID': '103920175', 'isAnonymous': False}, {'commentID': 103921178, 'status': 'approved', 'commentSequence': 103921178, 'userID': 58699902, 'userDisplayName': 'Bob Bunsen', 'userLocation': 'Portland Oregon', 'userTitle': 'NULL', 'userURL': 'NULL', 'picURL': None, 'commentTitle': '<br\\//>', 'commentBody': 'The American people elected Hillary Clinton as President, by 3 million votes. \n\nThe Electoral College elected Donald Trump.\n\nBlame this mess on the US Constitution, not the American people.', 'createDate': '1575268162', 'updateDate': '1575302929', 'approveDate': '1575280677', 'recommendations': 2, 'replyCount': 0, 'replies': [], 'editorsSelection': False, 'parentID': 103919944, 'parentUserDisplayName': 'N.G Krishnan', 'depth': 2, 'commentType': 'userReply', 'trusted': 0, 'recommendedFlag': 0, 'permID': '103921178', 'isAnonymous': False}]",2,approved,0,1575298906,N.G Krishnan,51275585,Bangalore India,NULL,NULL
46,21,1575251287,"The premise of this story trying to portray the Nuclear armed terror military as gentlemen above Trump is trying my patience. Gallagher IS what the military is, not as you may perceive in the white washed TV and movies. Trump IS the product of a military school in his formative years. You just can't accept the nightmare, can you? Your raising up the military as something above Gallagher's conduct is deeply naive.",103919954,103919954,<br\//>,comment,1575249264,1,False,False,,,103919954,https://s3.amazonaws.com/pimage.timespeople.nytimes.com/avatars/cropped-10a9e7297b90a4b5aa972d3cfe40faf15acea66b731f7e803811d99596581b54.jpg,1,0,[],0,approved,0,1575278805,PATRICK,85435430,In a Thoughtful state,NULL,NULL
47,22,1575251144,Let’s see how one affluent Liberal would stand up after 8 deployments to a war zone - with responsibilities that included killing terrorists.,103918674,103918674,<br\//>,comment,1575238319,1,False,False,,,103918674,,0,0,"[{'commentID': 103920213, 'status': 'approved', 'commentSequence': 103920213, 'userID': 88751984, 'userDisplayName': 'LauraF', 'userLocation': 'Great White North', 'userTitle': 'NULL', 'userURL': 'NULL', 'picURL': None, 'commentTitle': '<br\\//>', 'commentBody': '@Dr. John \n\nThere are likely lots of affluent liberals who have been deployed. \n\nOn that note, how many times were you deployed?', 'createDate': '1575251987', 'updateDate': '1575335408', 'approveDate': '1575256229', 'recommendations': 12, 'replyCount': 0, 'replies': [], 'editorsSelection': False, 'parentID': 103918674, 'parentUserDisplayName': 'Dr. John', 'depth': 2, 'commentType': 'userReply', 'trusted': 0, 'recommendedFlag': 0, 'permID': '103920213', 'isAnonymous': False}, {'commentID': 103920346, 'status': 'approved', 'commentSequence': 103920346, 'userID': 76267885, 'userDisplayName': 'Bob Guthrie', 'userLocation': 'Australia', 'userTitle': 'NULL', 'userURL': 'NULL', 'picURL': None, 'commentTitle': '<br\\//>', 'commentBody': '@Dr. John \n8 deployments against 6 deferments.\nThe Kurds killed the worst terrorists in assisting the USA; I wonder how they stood up as Trump abandoned them to his friend Erdogan.', 'createDate': '1575253453', 'updateDate': '1575307905', 'approveDate': '1575256231', 'recommendations': 14, 'replyCount': 0, 'replies': [], 'editorsSelection': False, 'parentID': 103918674, 'parentUserDisplayName': 'Dr. John', 'depth': 2, 'commentType': 'userReply', 'trusted': 0, 'recommendedFlag': 0, 'permID': '103920346', 'isAnonymous': False}, {'commentID': 103920297, 'status': 'approved', 'commentSequence': 103920297, 'userID': 73962600, 'userDisplayName': 'Semper fi', 'userLocation': 'Texas', 'userTitle': 'NULL', 'userURL': 'NULL', 'picURL': None, 'commentTitle': '<br\\//>', 'commentBody': '@ Dr John\nThis is not about liberal or conservative. It is about right and wrong, ethical versus unethical. Military order versus chaos and disorder. Military justice system versus capricious pandering by President Bone Spurs.', 'createDate': '1575252966', 'updateDate': '1575337608', 'approveDate': '1575256233', 'recommendations': 15, 'replyCount': 0, 'replies': [], 'editorsSelection': False, 'parentID': 103918674, 'parentUserDisplayName': 'Dr. John', 'depth': 2, 'commentType': 'userReply', 'trusted': 0, 'recommendedFlag': 0, 'permID': '103920297', 'isAnonymous': False}]",4,approved,0,1575251144,Dr. John,61584492,Seattle,NULL,NULL
48,23,1575251047,Obviously a stunt for Trump's base. He sees things solely in terms of personal self interest and just about everybody knows that including Melania whom he betrayed by having an affair with 2 women including a porn actress while his wife was in a post natal condition. It is a profound mystery as to why he keeps Evangelical support given that charming conduct and Access Hollywood.,103918426,103918426,<br\//>,comment,1575236988,1,False,False,,,103918426,,16,0,[],0,approved,0,1575337617,Bob Guthrie,76267885,Australia,NULL,NULL
49,24,1575250997,"Commander in Chief means just that. He’s top dog, king of the heap. Like him or hate him, many of the posts here talk of “chain of command.” Trump is boss. Period",103919719,103919719,<br\//>,comment,1575246955,1,False,False,,,103919719,,2,0,[],0,approved,0,1575255383,DanielMarcMD,77706074,Virginia,NULL,NULL
50,0,1575250962,"The military got into bed with this carnival barker, now reap what you sow.",103920077,103920077,<br\//>,comment,1575250555,1,False,False,,,103920077,,14,0,[],0,approved,0,1575337627,Matt,76107052,New York,NULL,NULL
51,1,1575250943,"Trumps actions show a lack of confidence and disrespect of the military system of justice, all for cheers at rallies and kudos on Fox shows and talk radio. War crimes are now officially sanctioned! If you're a draft dodger yourself, you should stay out of military affairs such as these. The military has been hugely disrespected, it's disgracful.",103918307,103918307,<br\//>,comment,1575236243,1,False,False,,,103918307,,15,0,[],0,approved,0,1575291238,Larry,76622186,Australia,NULL,NULL
52,2,1575250938,"Gallagher is a homicidal thug who was, by his own words, identified as predisposed to the taking of life.

If there is any truth to the allegations of his fellow soldiers, he should be on trial in The Hague as a war criminal - not being “excused” by Fox News and the President.

The Navy issued a slap on the wrist when a life-sentence would have been more appropriate. He’s in the same category of human as William Calley.",103918521,103918521,<br\//>,comment,1575237520,1,False,False,,,103918521,,19,0,[],0,approved,0,1575337633,PeterW,69448093,Ann Arbor,NULL,NULL
53,3,1575250896,"Now the clueless & cowardly 5X draft dodger who knows NOTHING about the military except how to avoid serving in it thinks he knows more about running it than the admirals & generals who have devoted their lives to it. The admirals & generals are now part of the #DeepState..

We might as well have elected Alex Jones. How can ANYONE still support this clown?",103918515,103918515,<br\//>,comment,1575237505,1,False,False,,,103918515,,24,0,[],0,approved,0,1575299037,Bill,13901309,"Terrace, BC",NULL,NULL
54,4,1575250889,"Why should Gallagher settle for a job with FAUX news, when the  position of Secretary of the Navy is now vacant?",103919016,103919016,<br\//>,comment,1575240397,1,False,False,,,103919016,,10,0,[],0,approved,0,1575299042,JD Athey,77008635,Oregon,NULL,NULL
55,5,1575250877,"“We just want to kill as many people as possible.” - Chief Petty Officer Edward Gallagher. (OK, I'm a civilian but for chrissakes, I would never say this about US Navy Seals. How could one of their own could say such a thing?)",103919027,103919027,<br\//>,comment,1575240460,1,False,False,,,103919027,,7,0,"[{'commentID': 103920330, 'status': 'approved', 'commentSequence': 103920330, 'userID': 69147700, 'userDisplayName': 'John ehmann', 'userLocation': 'Philly', 'userTitle': 'NULL', 'userURL': 'NULL', 'picURL': None, 'commentTitle': '<br\\//>', 'commentBody': 'I meant to hit reply not the other', 'createDate': '1575253303', 'updateDate': '1575257609', 'approveDate': '1575257609', 'recommendations': 0, 'replyCount': 0, 'replies': [], 'editorsSelection': False, 'parentID': 103919027, 'parentUserDisplayName': 'Avery', 'depth': 2, 'commentType': 'userReply', 'trusted': 0, 'recommendedFlag': 0, 'permID': '103920330', 'isAnonymous': False}]",1,approved,0,1575267534,Avery,4277162,NYC,NULL,NULL
56,6,1575250866,"""At the Pentagon, a conservative bastion where Fox News is the network of choice on office televisions..""

@nytimes - can you confirm if I understand correctly that the office TVs inside the Pentagon are tuned to Fox News?!",103919173,103919173,<br\//>,comment,1575241774,1,False,False,,,103919173,,5,0,[],0,approved,0,1575271591,Ramnam,20896727,Canada,NULL,NULL
57,7,1575250738,"Shame on you, 45.  You have never served your country in any capacity.  Sure, you think you're Commander-in-Chief.  Just like you think you're president.  You are those things in name only.  All you know how to lead is a failed reality TV show.  And a bankrupt casino.",103919554,103919554,<br\//>,comment,1575245348,1,False,False,,,103919554,,14,0,[],0,approved,0,1575291330,YogaGal,65387158,"San Diego, CA",NULL,NULL
58,8,1575248426,Many presidents have had no military experience. Trump's problems go much deeper than that.,103919647,103919647,<br\//>,comment,1575246274,1,False,False,,,103919647,,24,0,[],0,approved,0,1575291336,JimBob,5161936,Encino Ca,NULL,NULL
59,9,1575248425,"I wish it were possible to take an opinion poll of everyone who voted for trump in 2016, and see how many will vote for him again. I hope this incident with Gallagher will lose him a lot if support.",103919834,103919834,<br\//>,comment,1575248067,1,False,False,,,103919834,,12,0,[],0,approved,0,1575291346,Zhanna,60498910,California,NULL,NULL
60,10,1575248424,"President Trump's catastrophic handling of his relationship of the military is excellent news. President Trump is clearly, very clearly, chomping at the bit to become President-for-life. Both him and his base would have nothing against a nice little coup if voters vote him out : for, if he loses, the Illuminati and the Secret World Communist Party will have rigged the election, correct ? And that can not stand, of course. 
But the stunning incompetence of the Commander-in-Chief as far as leadership is concerned, means, for the moment at least, that the world can rest secure in the knowledge that the US military is in no mood to keep a man with a serious bone spurs problem in the White House.
Dear Americans, please believe when I tell you that we are millions of non-Americans scared to death at the prospect of an American dictator. Especially this one.",103919581,103919581,<br\//>,comment,1575245627,1,False,False,,,103919581,,15,0,"[{'commentID': 103920023, 'status': 'approved', 'commentSequence': 103920023, 'userID': 77112720, 'userDisplayName': 'Roberta', 'userLocation': 'Kansas City', 'userTitle': 'NULL', 'userURL': 'NULL', 'picURL': None, 'commentTitle': '<br\\//>', 'commentBody': ""@nestor potkine Thank you! Well said!\nVOTE in 2020, as if it's the last free election we'll ever have.  Because it very might be thanks to trump and his banana Republicans."", 'createDate': '1575249997', 'updateDate': '1575291392', 'approveDate': '1575256231', 'recommendations': 5, 'replyCount': 0, 'replies': [], 'editorsSelection': False, 'parentID': 103919581, 'parentUserDisplayName': 'nestor potkine', 'depth': 2, 'commentType': 'userReply', 'trusted': 0, 'recommendedFlag': 0, 'permID': '103920023', 'isAnonymous': False}]",1,approved,0,1575277952,nestor potkine,76342384,paris,NULL,NULL
61,11,1575248424,"Trump's military insults are piling up [CNN]

The President has insulted war heroes, prisoners of war, Gold Star families and, some critics say, tried to use the troops to score political points. He's directed 5% cuts at Veterans Affairs, which for some time he left in the control of non-veterans who happened to be members of his Mar-a-Lago club. He's neglected to visit combat zones, unlike other presidents, suggested troops' midterm election ballots not be counted, passed up Veterans Day ceremonies other leaders made time to attend and repeatedly said he knows more about military issues than generals do.

Trump redirects 3.6 Billion Dollars in active duty military funding to build his political wall.",103919628,103919628,<br\//>,comment,1575246078,1,False,False,,,103919628,https://s3.amazonaws.com/pimage.timespeople.nytimes.com/avatars/cropped-3f733a249b8edaa82e405847b69a24f7ee5f1c7541572a34faf3c25df9e5d247.jpg,19,0,[],0,approved,0,1575291423,Pray for Help,77751736,Connect to the Light,NULL,NULL
