,index,approveDate,commentBody,commentID,commentSequence,commentTitle,commentType,createDate,depth,editorsSelection,isAnonymous,parentID,parentUserDisplayName,permID,picURL,recommendations,recommendedFlag,replies,replyCount,status,trusted,updateDate,userDisplayName,userID,userLocation,userTitle,userURL
0,0,1575404542,"I am the proud grandchild of four immigrants, most of whom immigrated legally with all the requisite paperwork.  A few didn't although most of them returned to the country of origin.  None had high school educations; their paperwork said they could read and write.  At the time they immigrated, all sorts of people in many parts of the US objected to people coming from other countries for all sorts of reasons.  My grandparents felt and witnessed the rejection. 
However, my generation has produced four Ph.D.s, an architect, a pioneering computer programmer, an inventor with fifty patents and and another with ten books. We have all embraced the American dream and, indeed, contributed to the country. 
I am very happy that my grandparents are not here to see how immigrants are again being treated.  They would be appalled although not surprised. 
I am glad that the Times has published an unvarnished report about how some immigrants are being treated.  It speaks badly of American society and bodes ills for the future of the country.",103931353,103931353,<br\//>,comment,1575323671,1,True,False,,,103931353,,16,0,"[{'commentID': 103934657, 'status': 'approved', 'commentSequence': 103934657, 'userID': 8926818, 'userDisplayName': 'ann', 'userLocation': 'Seattle', 'userTitle': 'NULL', 'userURL': 'NULL', 'picURL': None, 'commentTitle': '<br\\//>', 'commentBody': '@Babs \nA 2/17 Inter American Dialogue Report titled ""Educational Challenges in Honduras and Consequences for Human Capital and Development” said the average Honduran, age 15 and above, has only a 4th grade education. Even those Hondurans who have attended school for more years do not do well on international tests for their grade levels. Guatemala and El Salvador have higher illiteracy rates than Honduras. \n\nMany people who migrated to the U.S. in earlier centuries were able to sustain themselves and their families despite having little formal education, but would not be able to do so today. It does not matter where migrants are coming from - if they have little education, today they will have a difficult time. Today’s poorly educated migrants will be heavily dependent on welfare and other subsidies for the rest of their lives.\n\nMany of the Salvadorans who migrated here in the 1980’s were so poorly educated they could not find places for themselves in our society. They formed a gang- MS -13 through which they committed such horrendous crimes that many of them were deported. Today’s migrants are no better educated than their earlier counterparts. How many of them will turn to gangs to supplement their incomes?\n\nRather than trying to absorb such poorly educated people, we could offer their countries Peace Corps volunteers who could improve their educational systems and who could encourage parents to send their children to school for more years.', 'createDate': '1575340281', 'updateDate': '1584803374', 'approveDate': '1575340283', 'recommendations': 23, 'replyCount': 0, 'replies': [], 'editorsSelection': False, 'parentID': 103931353, 'parentUserDisplayName': 'Babs', 'depth': 2, 'commentType': 'userReply', 'trusted': 0, 'recommendedFlag': 0, 'permID': '103934657', 'isAnonymous': False}, {'commentID': 103944180, 'status': 'approved', 'commentSequence': 103944180, 'userID': 48746523, 'userDisplayName': 'Lawrence', 'userLocation': 'San Francisco', 'userTitle': 'NULL', 'userURL': 'NULL', 'picURL': None, 'commentTitle': '<br\\//>', 'commentBody': '@Babs  I admire your family, but do not see how they can be compared to the present situation on the southern border.  If you were able to talk to your grandfather (May he Rest In Peace!), we could learn if he has a view that is different from yours.', 'createDate': '1575390405', 'updateDate': '1575425099', 'approveDate': '1575390406', 'recommendations': 8, 'replyCount': 0, 'replies': [], 'editorsSelection': False, 'parentID': 103931353, 'parentUserDisplayName': 'Babs', 'depth': 2, 'commentType': 'userReply', 'trusted': 0, 'recommendedFlag': 0, 'permID': '103944180', 'isAnonymous': False}]",2,approved,0,1575564748,Babs,59924164,Northeast,NULL,NULL
1,1,1575404483,Yes.  And send them back.,103936531,103936531,<br\//>,comment,1575355373,1,False,False,,,103936531,,8,0,[],0,approved,0,1584803382,BorisRoberts,68728806,"Santa Maria, CA",NULL,NULL
2,2,1575404483,"Since January 2019, people fleeing violence in some of the most dangerous countries in the world are not imprisoned when they ask for asylum in the US. They are instead waiting in refugee camps on the Mexican side of the US - Mexico border. Unlike refugee camps in Syria, Libya, & Bangladesh, no governments or relief agencies are providing services for these refugees. What food, shelter, medical care these thousands of people receive is provided by volunteers. 

Why has this issue become so pointlessly cruel?  Before January 2019, people seeking asylum in the US applied at the border & were allowed into the US to await their asylum hearings. Government records show that almost all asylum seekers showed up for their hearings before this new policy went in effect. We will look back at this time of brutality & blindness to human suffering with shame & sorrow. 

In 1939, the US refused to allow refugees fleeing Nazi Germany on the MSS St Louis to land in the US, sending them back to their deaths because they had not followed proper immigration procedures as they fled for their lives. In 2012, the State Dept apologized formally for this cruelty.  And now, so soon, we are doing it again.",103943497,103943497,<br\//>,comment,1575388822,1,False,False,,,103943497,,2,0,[],0,approved,0,1575564813,Carolyn Kelley,27682230,Austin TX,NULL,NULL
3,3,1575404482,"The American citizenry is under NO obligation to offer up our country as a pressure release valve for the world’s impoverished, overpopulated billions.  

Our government’s obligation is to serve the best interests of the ‘American citizenry’...which doesn’t include the over 20 Million illegal aliens brazenly residing here...and the tens of thousands  jumping our borders every month, at a cost to American taxpayers in the $Billions every year.

Enough histrionics over this issue!  Last I heard, we’re still a sovereign nation with defined borders and immigration laws. And that ain’t about to change anytime soon.",103936738,103936738,<br\//>,comment,1575359618,1,False,False,,,103936738,,12,0,[],0,approved,0,1584803398,Susanna,85993911,United States,NULL,NULL
4,4,1575404482,"As you can see from the reader picks; ""an enlightened civilization"" we are not.",103938248,103938248,<br\//>,comment,1575376503,1,False,False,,,103938248,https://s3.amazonaws.com/pimage.timespeople.nytimes.com/avatars/cropped-1051bf7116f92afc440fc79fa5b241ea8fa33db45b684a7c7cdafae012ba97f3.jpg,1,0,[],0,approved,0,1575466907,Discernie,73838799,"Las Cruces, NM",NULL,NULL
5,5,1575404481,NYT draws no Distinction between LEGAL and ILLEGAL.  Only the NYT can do these mental contortions of 1 thing and it’s opposite are actually the same thing. PT Barnum never hAd such an elaborate humbug in his circus. Trump was elected because people are tired of such scams; the joke is always on taxpayer,103934192,103934192,<br\//>,comment,1575337589,1,False,False,,,103934192,,7,0,[],0,approved,0,1584803410,ABC,77029179,Flushing,NULL,NULL
6,6,1575404481,"Another open borders piece full of emotion.
How many millions more does this writer advise? We already have at least 13. 
How much can the environment take?
Do we want to resemble SAmerica? Really?",103935259,103935259,<br\//>,comment,1575343850,1,False,False,,,103935259,,10,0,[],0,approved,0,1584803413,Gregory Benford,10814007,"Univ Calif, Irvine, CA",NULL,NULL
7,7,1575404481,"The American citizenry is under NO obligation to offer up our country as a pressure release valve for the world’s impoverished, overpopulated Billions.  Our government’s obligation is to serve the best interests of the ‘American Citizenry’....

...which doesn’t include the over 20 Million foreign nationals brazenly residing here illegally...along with the tens of thousands jumping our borders every month....exploiting our schools, hospitals, labor market, and public welfare services at a cost to American taxpayers in the $Billions year after year. Meanwhile, we can barely take care of our own.

Enough histrionics over this issue!  We’re a sovereign nation with defined borders and immigration laws.  And that ain’t about to change anytime soon.",103942955,103942955,<br\//>,comment,1575387618,1,False,False,,,103942955,,9,0,[],0,approved,0,1584803418,Susanna,85993911,United States,NULL,NULL
8,8,1575404312,"Even at the very liberal New York Times, at least half of the readers commenting have no patience with these arguments or with illegal immigration and bogus asylum claims which take advantage of our laws and generosity.  Illegal immigrants should be immediately deported; asylum laws must be changed so that we are not beholden to every person who enters the country and makes a claim; and legal immigration should be restricted in numbers and by merit.  And while praising Eisenhower for shutting down the detention centers, the author fails to mention that in the same year -- 1954 -- Eisenhower created a program to identify and deport illegal aliens.",103937929,103937929,<br\//>,comment,1575375039,1,True,False,,,103937929,https://s3.amazonaws.com/pimage.timespeople.nytimes.com/avatars/cropped-6eca9c74765855b4369107982e2790abb5bc3ede603d4c448709d0a8a91729a2.jpg,16,0,[],0,approved,0,1584803427,Grunt,53813087,Midwest,NULL,NULL
9,9,1575404057,close *all* prisons,103934155,103934155,<br\//>,comment,1575337414,1,False,False,,,103934155,,1,0,[],0,approved,0,1575404973,Theo,81859308,NYC,NULL,NULL
10,10,1575404057,Go home and make Your country great!,103935450,103935450,<br\//>,comment,1575344827,1,False,False,,,103935450,,10,0,[],0,approved,0,1584803458,Pjlit,91809071,Southampton,NULL,NULL
11,11,1575404057,"Close all the disgusting immigration prisons. Yes, locking up immigrants for a civil violation is legal.  Slavery and Jim Crow were also legal, as is the whole racist criminal justice system.  
Get rid of the ICE gestappo, who terrorize families in the middle of the night. ICE are just runaway capitalism’s jack-booted thugs, instilling fear in workers so that they will never assert their rights or challenge labor violations.  
Allow undocumented people to adjust their status so that they can come out of the shadows. Give all workers equal rights so that businesses no longer have an incentive to exploit migrants.  Stop using my tax dollars to exile and jail people because of their national origin.",103936265,103936265,<br\//>,comment,1575351677,1,False,False,,,103936265,,0,0,[],0,approved,0,1575404057,Andrew,92937493,MA,NULL,NULL
12,12,1575402921,"The NYT and the Democratic Party seem to have the same program: celebrate everything that reflects badly on white people (as Michelle Goldberg does today) and push for virtually limitless immigration (as this writer does).  Since we live in a democracy, I imagine that they will finish by winning, since the importation of people fond of Democratic policies will eventually tip the electoral balance in their favor.  Which, as political thinkers have warned about for centuries, will lead to something resembling an American Caesar.  You'd think Trump would be bad enough for them.  Why don't they take the hint and stop?",103936692,103936692,<br\//>,comment,1575358474,1,False,False,,,103936692,,7,0,[],0,approved,0,1584803494,Bob Roberts,10095623,Tennessee,NULL,NULL
13,13,1575395070,"Mr. Garcia Hernandez assumes that the government wants to behave benevolently.  The current U.S. government wants to hurt a great many people, and immigrants are at or close to the to top of the list.  It's horrifying to realize, but it actually does seem that a variety of people in the Trump Administration and among Republican politicians in Congress take pleasure in inflicting suffering not only on immigrants, but on non-elites among U.S. citizens.  To such people, Mr. Garcia Hernandez' observations are a reason to continue doing what they're doing.",103946418,103946418,<br\//>,comment,1575395069,1,False,False,,,103946418,,0,0,[],0,approved,0,1584803509,Stephen Merritt,7435219,Gainesville,NULL,NULL
14,14,1575393077,"How about we ban these lawbreakers from invading our country?

There are immigration jails because people refuse to follow the laws currently in place, and criminals need a place to go-jail.

Stay and fix your 3rd world country instead of bringing your problems here.",103941201,103941201,<br\//>,comment,1575384022,1,False,False,,,103941201,,18,0,[],0,approved,0,1584803517,stan,55100856,MA,NULL,NULL
15,15,1575393077,"Apparently, we need more.",103943642,103943642,<br\//>,comment,1575389134,1,False,False,,,103943642,,5,0,[],0,approved,0,1575485531,Ryan Bingham,71851588,Up there...,NULL,NULL
16,16,1575392380,"I'm sorry but spending billions of dollars on legal services for illegal immigration advocacy is not a solution.  Neither is calling illegal immigrants ""migrants"", as if changing the word somehow changes the legality of crossing a sovereign nation's border, without permission to do so.  Sparing migrants the long trek and ultimate disappointment of not getting in to the US (or for those who do cross, the constant fear of being deported) should be the priority.  This means investing in South and Central American countries and stopping gang violence so that people don't have to risk everything, including their lives, for a dream that is likely to end in sorrow.  We can be practical and humanitarian at the same time.",103931392,103931392,<br\//>,comment,1575323850,1,True,False,,,103931392,,136,0,"[{'commentID': 103948357, 'status': 'approved', 'commentSequence': 103948357, 'userID': 77001221, 'userDisplayName': 'JohnBarleycorn', 'userLocation': 'Virgin Islands', 'userTitle': 'NULL', 'userURL': 'NULL', 'picURL': None, 'commentTitle': '<br\\//>', 'commentBody': '@John Spelled out: It is not a fundamental human right to demand access to live and work in a country in which you are not a citizen. \n\nWe suggest only Americans who have traveled and worked - legally - in foreign countries and gone through the lengthy, legal processes to get work visas have the right to opine on immigration. \n\nFirst hand experience as a worker/immigrant changes your attitude. \n\nJust this past week the New York Times published a piece telling young (US citizens) what they needed to work in a foreign country: A college degree, no criminal background. \n\nWould the NYTs extend the same requirements to those looking to come to the US?', 'createDate': '1575399335', 'updateDate': '1584803532', 'approveDate': '1575401919', 'recommendations': 13, 'replyCount': 0, 'replies': [], 'editorsSelection': False, 'parentID': 103931392, 'parentUserDisplayName': 'John', 'depth': 2, 'commentType': 'userReply', 'trusted': 0, 'recommendedFlag': 0, 'permID': '103948357', 'isAnonymous': False}]",1,approved,0,1588816858,John,72872895,Cactose,NULL,NULL
17,17,1575392335,"No person either born in Mexico or in Canada should be imprisoned if that person is here without the proper documents. The reason is that it is only right that Mexico, the USA and Canada become one nation soon.

Mexicans have a greater right to the entire North American Continent than any one else except for Native Americans. They were here before the Asians, Africans or Europeans arrived.

Let us work to speed up the process of creating one nation, the  United States of North America, USNA.",103936900,103936900,<br\//>,comment,1575363551,1,True,False,,,103936900,,3,0,[],0,approved,0,1575417197,Indian Diner,51549698,NY,NULL,NULL
18,18,1575392174,Trump's cruelty 're' jailing immigrants seeking asylum is a corrupt practice based on xenophobia (under the White House 'boot' of White Nationalist Stephen Miller). Allowing these United States to renegue on it's status as 'an immigrant country' is hypocritical... if not perverse.,103933940,103933940,<br\//>,comment,1575336296,1,False,False,,,103933940,,0,0,[],0,approved,0,1575392174,manfred marcus,47112177,Bolivia,NULL,NULL
19,19,1575392158,"No, immigrants don't endanger public safety...unless you were were one of illegal immigrant Mr. Escobar's victims, one of three sleeping homeless men he bludgeoned to death in LA - several were African-American by the way. Sorry about that. 
Unless you were a Washington State deputy who was killed by an illegal immigrant.  He left a grieving family behind. Sorry, but there will be some collateral damage, it can't be helped.. 
Unless, you were Ms. Bambi Larson and killed by Mr. Carranaza in San Jose. 
Unless.......the list goes on and on.  
But please, don't let me interrupt your lofty virtue-signaling and coffee shop philosophizing.",103935740,103935740,<br\//>,comment,1575346914,1,False,False,,,103935740,,12,0,[],0,approved,0,1584803591,whatever,68437922,los angeles,NULL,NULL
20,20,1575392138,The author is no kook.  But his proposal is way out there.  And he surely knows it.  The purpose here must be to stretch our imaginations and get us to think.  Mission accomplished.,103936354,103936354,<br\//>,comment,1575352627,1,False,False,,,103936354,https://s3.amazonaws.com/pimage.timespeople.nytimes.com/avatars/cropped-4d62f8454e6e9673b466b410eef2d542fb7b9e81a571d43def5bf837c6651a26.jpg,3,0,[],0,approved,0,1575418921,michjas,48147869,Phoenix,NULL,NULL
21,21,1575392119,"When the business is bigger than humanity and decency, the business will prevail. As the climate change effects worsen conditions of livelihood in Latin America, the business of imprisoning immigrants is going to grow like waltmarts.",103940047,103940047,<br\//>,comment,1575381490,1,False,False,,,103940047,,0,0,[],0,approved,0,1575392119,hugo,64807619,pacific nw,NULL,NULL
22,22,1575392077,"They've overpopulated their own countries so badly they've become unlivable, but we're supposed to spend $2.7 billion a year helping them game the system to get permanent residency here? No thanks.",103936545,103936545,<br\//>,comment,1575355624,1,False,False,,,103936545,https://s3.amazonaws.com/pimage.timespeople.nytimes.com/avatars/cropped-6f55ad044097867ba6722bdc31032cce56df5a6ca321e7d318c67b827a430dfa.jpg,15,0,"[{'commentID': 103945894, 'status': 'approved', 'commentSequence': 103945894, 'userID': 76112301, 'userDisplayName': 'Pat', 'userLocation': 'Roseville CA', 'userTitle': 'NULL', 'userURL': 'NULL', 'picURL': None, 'commentTitle': '<br\\//>', 'commentBody': ""@Green Tea \nI am not in favor of open borders , but I'm going to have to call malarkey. I googled population densities for these countries. Guatamala 418/sq.mi., Honduras 226/sq.mi.,  Mexico 150/sq.mi.,  Germany 750/sq.mi.,  England 780/sq.mi.  While the USA as a whole comes in at 92/sq.mi. New York State comes in at 421/sq.mi  and Florida has 353/sq.mi. They don't walk thousands of miles on a whim . They come desperate to escape violence and famine.  Gee where have we heard that narative before."", 'createDate': '1575393906', 'updateDate': '1575402921', 'approveDate': '1575402921', 'recommendations': 0, 'replyCount': 0, 'replies': [], 'editorsSelection': False, 'parentID': 103936545, 'parentUserDisplayName': 'Green Tea', 'depth': 2, 'commentType': 'userReply', 'trusted': 0, 'recommendedFlag': 0, 'permID': '103945894', 'isAnonymous': False}]",1,approved,0,1584803606,Green Tea,11939558,Out There,NULL,NULL
23,23,1575392077,"It looks like I dont have to go into how outrageous this article is. The folks already get it. Its advocating for open borders, period. The question is, where is such anti-American advocacy coming from, and how do we stop it? Well, we all know the political leanings of this paper. Its pro Democrat anti-Trump to the tenth degree. Just by printing such an article, it offers a platform, whose intention is to change the conversation, create a narrative, and hope it becomes mainstream enough to translate into votes. 
Elections are about choices. Its a binary choice. We have Republican and Democrat. We will have Trump, and whomever is the Democrat nominee, of whom all of them lean in the direction of the premise of this article. Yes, even Joe Biden when he raised his hand to decriminalize crossing the border illegally.
The question is, whom would Professor Hernandez hope we vote for? 
Trump, or the Democrat?",103937292,103937292,<br\//>,comment,1575370882,1,False,False,,,103937292,,5,0,"[{'commentID': 103945950, 'status': 'approved', 'commentSequence': 103945950, 'userID': 76112301, 'userDisplayName': 'Pat', 'userLocation': 'Roseville CA', 'userTitle': 'NULL', 'userURL': 'NULL', 'picURL': None, 'commentTitle': '<br\\//>', 'commentBody': '@Sports Medicine \nI know who Putin wants for president.', 'createDate': '1575394046', 'updateDate': '1575419056', 'approveDate': '1575404481', 'recommendations': 1, 'replyCount': 0, 'replies': [], 'editorsSelection': False, 'parentID': 103937292, 'parentUserDisplayName': 'Sports Medicine', 'depth': 2, 'commentType': 'userReply', 'trusted': 0, 'recommendedFlag': 0, 'permID': '103945950', 'isAnonymous': False}]",1,approved,0,1575485665,Sports Medicine,92473206,NYC,NULL,NULL
24,24,1575392077,"We could certainly redirect the money to repatriation flights/buses and close the prisons.

""Even when migrants have a criminal history, immigration prison isn’t the right answer. ""

No other sentence from this op ed need be read to assess the author's wokeness.  Of course, he doesn't supply any ""right answer"" either, but just another anecdote.",103944407,103944407,<br\//>,comment,1575390929,1,False,False,,,103944407,https://s3.amazonaws.com/pimage.timespeople.nytimes.com/avatars/cropped-788bfbcc4b00dea9f14a3d53a06924de9994cd7d90cd3b5bd46a3404b867fd14.jpg,9,0,[],0,approved,0,1577303217,kwb,61745309,"Cumming, GA",NULL,NULL
25,0,1575392075,I do not understand why kidnapping children during these past months was not in itself immediately impeachable. Who are we? Where are the sane and humane leaders we have always relied on to uphold American values? So let’s go on spending millions of our dollars to feed the fat Orwellian cats running these centers that reek of human suffering.,103935271,103935271,<br\//>,comment,1575343912,1,False,False,,,103935271,,0,0,[],0,approved,0,1575392075,Maggie C.,73178205,"Poulsbo, WA",NULL,NULL
26,1,1575392075,"The title of this op ed should be ""Abolish Immigration Controls"" because that is exactly what this author is espousing in this piece. 

""And there will be others who get their day in court only to lose. When that happens, two options are available. We could arrest and deport those people, or we could turn the other way.""

Turn the other way? You mean just let them go? What a lame argument for open borders. As I read that I sank back into my chair knowing that Trump is going to win in 2020 on this issue. Just like he won in 2016 on this issue. Sad!",103943830,103943830,<br\//>,comment,1575389609,1,False,False,,,103943830,,10,0,[],0,approved,0,1584803699,Dan,21048511,"Denver, Co.",NULL,NULL
27,2,1575392073,"Obviously, the easy way to stay out of jail is to obey the law. ""Migrants"" are not being sent to prison; criminals are. There is precisely no reason to afford someone here illegally with the slightest ""process"". The interview should consist of one question: ""are you here legally""? If not, out you go. Immediately. No courts. No lawyers. No delay. Out. 

Unskilled immigrants in general and illegals in particular are hugely expensive drags on the taxpayers. We do not owe foreigners anything, let alone foreign criminals who break immigration law, impersonate others, commit fraud to work, and soak up scarce taxpayer dollars. 

Truly, this is not a difficult question: if you're here illegally, go home. Do it tomorrow. And if you refuse, don't whine when the law catches up with you and send you back where you belong. 

Should we have ""comprehensive"" reform? Of course! We should adopt immigration policies akin to those of Canada or Australia. And adopt policies which ensure that anyone violating those laws is caught and evicted. With all deliberate speed. 

We don't need jails for illegals; they should be deported the day they are detained. Problem solved.",103942351,103942351,<br\//>,comment,1575386191,1,False,False,,,103942351,,10,0,[],0,approved,0,1584803710,Michael,6393110,"Morris Township, NJ",NULL,NULL
28,3,1575392071,When you set the quota of legal immigrants low enough you will have plenty of illegal immigrants fleeing poverty and violence. Welcome to the so called greatest and christian country in the world where we throw the poorest and unprotected in cages owned by corporations.,103937800,103937800,<br\//>,comment,1575374524,1,False,False,,,103937800,,0,0,[],0,approved,0,1575392071,3Rivers,79123470,S.E. Washington,NULL,NULL
29,4,1575392070,"Something like 70% of the legal applicants for asylum never return to court after their release.

And you want to encourage illegal immigration.

No.",103934449,103934449,<br\//>,comment,1575339055,1,False,False,,,103934449,,9,0,[],0,approved,0,1584803725,Ernest Montague,76185751,"Oakland, CA",NULL,NULL
30,5,1575392070,Immigrants increase the labor pool thereby depressing wages for existing citizens. Democrats cannot be the pro-labor party if they advocate for increasing immigration.,103934670,103934670,<br\//>,comment,1575340405,1,False,False,,,103934670,,10,0,[],0,approved,0,1584803732,Demelza,85620760,San Francisco,NULL,NULL
