,index,approveDate,commentBody,commentID,commentSequence,commentTitle,commentType,createDate,depth,editorsSelection,isAnonymous,parentID,parentUserDisplayName,permID,picURL,recommendations,recommendedFlag,replies,replyCount,status,trusted,updateDate,userDisplayName,userID,userLocation,userTitle,userURL
0,0,1575341223,"Sign the bill.  By being partisan instead of doing  what is best for the country, Democrats would be just like the Republican.  People are sick of it.",103927128,103927128,<br\//>,comment,1575308357,1,False,False,,,103927128,https://s3.amazonaws.com/pimage.timespeople.nytimes.com/avatars/cropped-b963c7c9c6946df551ea146de1bd314674747f14242e40c079168afcbb851894.jpg,1,0,[],0,approved,0,1575488152,Robert kennedy,68505124,Dallas Texas,NULL,NULL
1,1,1575340312,"So Democrats are “conflicted” between doing what’s best for the country and workers, versus the political downside of agreeing with Trump.  Sad to say, the irony here is that Democratic ambivalence proves the Republican point that Democrats care more about politics and their preoccupation with Trump,  than with doing right by our country.",103934046,103934046,<br\//>,comment,1575336809,1,False,False,,,103934046,,2,0,[],0,approved,0,1575342286,LTJ,60580402,Utah,NULL,NULL
2,2,1575340310,"""The Great Divider"" Trump needs the USMCA deal, if only because he's branded himself as a great deal-maker, yet he hasn't made any big ones since he's been in office.  His ghost writer for ""Art of the Deal"" has long labeled him a fraud, and indeed he is.  USMCA isn't really a Trump deal because Lighthizer is the prime mover; as with any other Trump presidential ""deal"" (like the '17 tax law), he's a mere cheerleader.

Yet giving him a rare win is no excuse for not passing USMCA.  If Dems' concerns are addressed by Lighthizer and our partners north and south of the border, then they should support it and give Americans a bonus for enduring all the failure, chaos, and bumbling of this administration.

Farmers here in Iowa seem to be touting USMCA, and this state has 3 Dem seats of 4--all with a strong farm interest--to defend in 2020.  No need to address Trump's charge that the House Dems are incapable of doing anything, but it would be an easy rebuttal to such nonsense, esp for our Iowa Dems.",103933865,103933865,<br\//>,comment,1575335918,1,False,False,,,103933865,,1,0,[],0,approved,0,1575348608,Tom,40554285,"Des Moines, IA",NULL,NULL
3,3,1575336038,"""Even a blind hog finds a piece of corn sometimes"". This applies to trump.He can do something constructive even though he sees it for seems for his own benefits. If its a good deal then the Dems and hopefully the repubs should take it. Trump is being impeached for very definite actions and as long as he isPresident and sems to allow a positive event, take it.",103926517,103926517,<br\//>,comment,1575306407,1,False,False,,,103926517,,0,0,[],0,approved,0,1575336038,Richard Head,61584603,Mill Valley Ca,NULL,NULL
4,4,1575336019,The USMCA trade agreement is separate from the impeachment inquiry.  The democrats need to work and compromise with Trump where it benefits Americans.  The country comes before politics.,103933574,103933574,<br\//>,comment,1575334411,1,False,False,,,103933574,https://s3.amazonaws.com/pimage.timespeople.nytimes.com/avatars/cropped-3212665455811f2289e7f4fb0f29224ad0756148f98d6a0afdfb5f889c6a8da1.jpg,1,0,[],0,approved,0,1575341935,P Locke,65537809,Albany NY,NULL,NULL
5,5,1575331493,The premise of this article is unfounded.  Democrats will vote for the bill once it is finalized.,103932544,103932544,<br\//>,comment,1575328952,1,False,False,,,103932544,,0,0,[],0,approved,0,1575331493,ira,68042281,great barrington,NULL,NULL
6,6,1575328091,"It is disappointing that this article and commenters do not mention Mexico's politics.  In particular the 2018 victory of a mostly left coalition led by Lopez Obredor, who had previously just lost in two controversial elections.  The coalition included AMLO's social democratic party as well as two smaller parties:  the Labor Party (!) and a right-wing party. Wouldn't this be relevant to the proposed trade deal's provisions?

It seems that recent Mexican politics -- affecting the country's 100 million people-- is almost invisible and not a concern to Americans.  Shouldn't it be a concern at least to the liberal media and Democrats -- who amply vocalize and moralize about the admittedly terrible developments along the border.

The last Mexican politician to make a dent in the American conscience was high-in-the-saddle Vincente Fox (out 2006); his PAN Party got 22% vote in 2018.  Of course drug-gang violence and pervasive corruption are amply covered, and rightly so.",103930681,103930681,<br\//>,comment,1575321104,1,False,False,,,103930681,,0,0,[],0,approved,0,1575328091,jdh,69225984,Austin TX,NULL,NULL
7,7,1575328090,"I actually disagree with the premise that because the Dems would side with tRump on an issue that has been dear to our heart. Free and fair trade is in anyway a quandary, especially when some in the GOP will vote against it. It’s actually showing that while they can support a corrupt president they can’t hide their true colors when it comes to corporations vs the people",103932031,103932031,<br\//>,comment,1575326642,1,False,False,,,103932031,,0,0,[],0,approved,0,1575328090,Luc Benech,69230959,Palm Springs,NULL,NULL
8,8,1575328081,"Easy Nancy. Slow this train down. As a concerned citizen I want to hear all the facts and details before our members of the House run-off for a feel-good vote. This bill needs to be fully aired-out so we know what we are getting into and that we don’t have another NAFTA debacle like what was delivered by Bill Clinton and the neo-liberals of yesteryear. American workers, consumers, and the environment doesn’t need to get burned again. The devil is in the details.",103927263,103927263,<br\//>,comment,1575308776,1,False,False,,,103927263,,0,0,[],0,approved,0,1575328081,Sendan,82518853,Manhattan side,NULL,NULL
9,9,1575320990,"Dems are able to chew gum and walk at the same time.  Trump uses everything he does as a brag or to trash others whether the action is good or not.  

If this agreement works for the US I see no reason why Dems should not accept it and also continue to pursue Trump on Abuse of Power.",103926344,103926344,<br\//>,comment,1575305827,1,False,False,,,103926344,,1,0,[],0,approved,0,1575326045,B. Rothman,44420772,NYC,NULL,NULL
10,10,1575320943,"If it's a good pact for the American worker, bring it to a vote and pass it.  Trump got elected in part because he promised to stand up for American manufacturing, and it looks like he's delivered.

The vote next year is going to reflect who Trump is, not necessarily what he's done.  Democrats could demonstrate that they are willing to rise above partisanship and deliver for their constituents, and take credit for an attitude that is sorely lacking from Republicans.

If Democrats refuse to move forward on this, in what way are they a better choice?",103925867,103925867,<br\//>,comment,1575304246,1,True,False,,,103925867,,18,0,"[{'commentID': 103933534, 'status': 'approved', 'commentSequence': 103933534, 'userID': 65537809, 'userDisplayName': 'P Locke', 'userLocation': 'Albany NY', 'userTitle': 'NULL', 'userURL': 'NULL', 'picURL': 'https://s3.amazonaws.com/pimage.timespeople.nytimes.com/avatars/cropped-3212665455811f2289e7f4fb0f29224ad0756148f98d6a0afdfb5f889c6a8da1.jpg', 'commentTitle': '<br\\//>', 'commentBody': '@Paul Downs I totally agree with you!', 'createDate': '1575334197', 'updateDate': '1575335993', 'approveDate': '1575335993', 'recommendations': 0, 'replyCount': 0, 'replies': [], 'editorsSelection': False, 'parentID': 103925867, 'parentUserDisplayName': 'Paul Downs', 'depth': 2, 'commentType': 'userReply', 'trusted': 0, 'recommendedFlag': 0, 'permID': '103933534', 'isAnonymous': False}]",1,approved,0,1576833665,Paul Downs,40279870,Philadelphia,NULL,NULL
11,11,1575320199,"Trump has lied so much about NAFTA (and everything else) that no one should take the updated NAFTA as good for anyone but Trump himself. 

If Pelosi supports it , after some changes , maybe it is worthwhile.",103924295,103924295,<br\//>,comment,1575298798,1,False,False,,,103924295,,1,0,[],0,approved,0,1575326074,Duncan Lennox,53265405,Canada,NULL,NULL
12,12,1575319919,"""“Taken as a whole, it looks more like an agreement that would’ve been negotiated under the Obama administration,” said Senator Rob Portman, Republican of Ohio...""

Except it wasn't. Why is that?",103927242,103927242,<br\//>,comment,1575308705,1,False,False,,,103927242,https://s3.amazonaws.com/pimage.timespeople.nytimes.com/avatars/uncropped-8f510b97e5abae7d69010f55afeb24f07648674483f8b47a9b3c17a559eb996a.jpg,1,0,[],0,approved,0,1575342001,BlackJack,79004534,Vegas,NULL,NULL
13,13,1575319919,"Sorry, but if it has the trump name associated with it, then it should fail.",103927473,103927473,<br\//>,comment,1575309394,1,False,False,,,103927473,,0,0,[],0,approved,0,1575319919,Lewis,4777036,"Austin, TX",NULL,NULL
14,14,1575319118,"Reading some of the comments here it seems there are a few, thankfully very few, who insist on damning the President but then support the trade deal. I am a Democratic Socialist, and a dues paying one at that, but to pretend that Trump has not been better on trade policy, has deported fewer people, and has at least tried to roll-back the eternal way machine of the Military Industrial Complex.",103927742,103927742,<br\//>,comment,1575310319,1,False,False,,,103927742,,1,0,[],0,approved,0,1575324942,Christopher Hull,88513627,Los Angeles,NULL,NULL
15,15,1575319112,"Democrats simply have to say yes to principles they have long held, Republicans, on the other hand, have to do the right thing for workers - that's the real tough ask here.",103929759,103929759,<br\//>,comment,1575317456,1,False,False,,,103929759,,0,0,[],0,approved,0,1575319112,Haynannu,70016683,Poughkeepsie NY,NULL,NULL
16,16,1575319109,"Democrats never learn from Republicans: the answer to this trade deal using Republican strategy is very simple - proclaim it insufficient as long as the other side controls the government. Always claim the Republican deal is a bad deal. Always claim the Republicans have been outsmarted. 

Will the Democrats use Republican tactics? No, Democrats don't get Republican tactics and practice. Democrats represent the weakling wing of the GOP - incapable/unwilling of truely opposing the GOP from any perspective.",103929644,103929644,<br\//>,comment,1575317049,1,False,False,,,103929644,,2,0,[],0,approved,0,1575338221,stewart bolinger,65062988,"westport, ct",NULL,NULL
17,17,1575319108,Democrats should vote the Trade Agreement on its own merits.  They should know by now that Trump will use the vote to his personal advantage anyway.,103929751,103929751,<br\//>,comment,1575317432,1,False,False,,,103929751,,1,0,[],0,approved,0,1575342047,Adolfo Rufatt,62717444,Chile,NULL,NULL
18,18,1575319102,Here is a revolutionary idea: Put the interests of the American people and the country ahead of partisan politics. Maybe then the Democrats will regain the respect they once enjoyed.,103926445,103926445,<br\//>,comment,1575306153,1,False,False,,,103926445,,1,0,[],0,approved,0,1575342053,Listner,93462850,New York,NULL,NULL
19,19,1575318331,"The headline in print referred to a ""quandary"" for the Democrats.  The Times article set out that the revised NAFTA agreement obtained by the Trump Administration is ""one of the most progressive trade pacts ever negotiated by either party,"" with, moreover, ""aspects to it that Democrats have been calling for, for decades,""  But that, the Times reported, has put Democrats in a ""quandary.""  Democrats face a ""difficult choice"" because with Congressional approval the revised pact would stand as an accomplishment of the Trump Administration.  

One should keep in mind that ""quandary"" and ""difficult choice"" when hearing the high-minded rhetoric from Democrats about how a Trump impeachment is necessary to save the Constitution and American democracy and requires all their attention to the exclusion of otherwise governing as in fact they were elected to do. 

A foreordained impeachment, by the way, that Democrats know will result in an equally foreordained acquittal in the Senate.",103928504,103928504,<br\//>,comment,1575312887,1,False,False,,,103928504,,1,0,[],0,approved,0,1575342084,Donald Nawi,60110392,"Scarsdale, NY",NULL,NULL
20,20,1575318329,"If this is good for the country, Dems should vote for it.

Then, each and every day -- they should remind the press that close to 400 Bills passed by the Democratic-controlled House are stalled in the Republican-controlled Senate as they await Republican action.",103928198,103928198,<br\//>,comment,1575311911,1,False,False,,,103928198,,0,0,[],0,approved,0,1575318329,Barbara T,52721780,Swing State,NULL,NULL
21,21,1575318328,"New NAFTA or no, nothing will make the low skilled manual labor jobs return to American shores. The only solution is moving up the value chain - that means investing in skills and education at all levels. Any new factories under construction today in the USA are majority staffed with robots.",103927549,103927549,<br\//>,comment,1575309607,1,False,False,,,103927549,https://s3.amazonaws.com/pimage.timespeople.nytimes.com/avatars/cropped-74b274f8f7ac773559f4fcb4b1c7236f73aa827a209c538ead4f5709a5a6a25d.jpg,0,0,[],0,approved,0,1575318328,Nick,60623446,Egypt,NULL,NULL
22,22,1575318328,"""Trump’s Trade Deal Steals a Page From Democrats’ Playbook""

No, I don't think so. Democrats have never been in favor of either unpredictable, chaotic, approach to US economy, nor they have been in the business of hurting US allies.  

If Democrats needed to do something that could run against the interest of an ally, they first give the alley a heads up, consult with the alley and try to jointly find ways that could reduce the negative impacts of the US economic decision on the alley.",103928395,103928395,<br\//>,comment,1575312515,1,False,False,,,103928395,,0,0,[],0,approved,0,1575318328,Eddie B.,66960324,Toronto,NULL,NULL
23,23,1575318322,"Trade agreements are complex, but that’s no excuse for the reporting on it to be so lazy. These agreements have always been a source of genuine controversy within the Dem caucus, regardless of who the President is. Fact check: a Dem did NOT negotiate the original NAFTA, although Pres. Clinton did push through ratification (with lots of GOP votes, and lots of pushback from his own party). And the USMCA is NOT significantly more progressive than the TPP agreement negotiated by Pres. Obama, which also was opposed by many Dems in Congress (and almost all “free trade” GOPers, for reasons mainly driven by spite). USMCA mostly reflects what Canada and Mexico already had agreed to in the TPP, doesn’t fix the glaring enforcement pitfalls that make any new labor standards just as meaningless as the old ones, contains a giant giveaway to big PHARMA, and has a special carve out that allows foreign oil and gas companies to continue dragging our government into private arbitration over environmental regs they don’t like. I know journalists love to frame absolutely every topic as a substance-free partisan power struggle, but I’m missing the central premise here that Dems have anything real to love in this weak reboot of NAFTA.",103928152,103928152,<br\//>,comment,1575311784,1,False,False,,,103928152,,0,0,[],0,approved,0,1575318322,J.L.,45107395,Iowa,NULL,NULL
24,24,1575314592,"In terms of manufacturing, how does the new trade deal address technology and robotics?  Many manufacturing jobs will never return because of technology improvements.",103928947,103928947,<br\//>,comment,1575314591,1,False,False,,,103928947,,0,0,[],0,approved,0,1575314592,Stanley,55123130,"Hayward, CA",NULL,NULL
25,0,1575311206,"Two additional facts worth contemplating:
According to the American Farm Bureau Federation, government aid in its various forms, including ""trade aid"" brought about by the trade war, will make up over 37 percent of farm income this year.
As for tariffs, they continue to tax the middle class to offset a portion of the growing budget deficit brought on by tax breaks that mostly benefited the wealthy.  
The reason that tariffs are a middle class tax is simple: the consumption of consumer goods does not correlate directly to wealth.  For example, even if someone has twenty times as much money, they do not use twenty times as many washing machines.  They do not watch twenty televisions instead of one.  So the purchase of consumer goods takes a larger percentage of middle class income.  And since tariffs are offset by higher prices, they are a hidden tax on middle class incomes.",103927961,103927961,<br\//>,comment,1575311205,1,False,False,,,103927961,,2,0,[],0,approved,0,1575313264,John Walker,66872516,Coaldale,NULL,NULL
26,1,1575310995,"The reality is that while Trump will brag, I don't see him getting much more that his 63 million from last time.

If the Dems can get those last changes incorporated, they stand to get a strong positive bump, maybe even from farmers.",103926675,103926675,<br\//>,comment,1575306914,1,False,False,,,103926675,,3,0,[],0,approved,0,1575500656,John Hanzel,22599748,Glenview,NULL,NULL
27,2,1575310990,"Democrats have been screaming for months about placing The Nation above Party.
HERE is THE perfect example, and they are QUESTIONING whether they should give Trump a ""win"" ???
I am absolutely no fan of trump, but good grief, this is NOT a party issue.  It is What's Good For The Nation.
Period.
Any Dem who votes against this should lose his Congressional seat in 2020.",103927117,103927117,<br\//>,comment,1575308334,1,False,False,,,103927117,,10,0,"[{'commentID': 103929376, 'status': 'approved', 'commentSequence': 103929376, 'userID': 76490251, 'userDisplayName': 'Martini', 'userLocation': 'Temple-Beaudry, CA', 'userTitle': 'NULL', 'userURL': 'NULL', 'picURL': None, 'commentTitle': '<br\\//>', 'commentBody': 'This is clearly an opinion piece. No where have they quoted or actually talked to democrats who say their worried about the politics of passing the bill. They know Trump needs a win and their trying to make the trade agreement even more progressive before they bring it to the floor.', 'createDate': '1575316211', 'updateDate': '1575318333', 'approveDate': '1575318333', 'recommendations': 0, 'replyCount': 0, 'replies': [], 'editorsSelection': False, 'parentID': 103927117, 'parentUserDisplayName': 'cynic2', 'depth': 2, 'commentType': 'userReply', 'trusted': 0, 'recommendedFlag': 0, 'permID': '103929376', 'isAnonymous': False}]",1,approved,0,1575919274,cynic2,56792725,Missouri,NULL,NULL
28,3,1575310989,"Key phrase: ""IF (as in, IF) provisions are enforced...."" Then, perhaps, IF they are, some portions of the proposed deal are less objectionable than the original NAFTA.

Does anyone really believe ANY provision of the proposed deal that strengthens workers' rights or environmental protection will be enforced, rather than circumvented by whatever means available, in Mexico, and the US, and in Canada? 

There is literally nothing in this administration's record that suggests it is anything but actively hostile to environmental protections, and indifferent at best, despite rhetoric to the contrary, to workers' rights of any kind.

Pelosi would be foolish (or complicit) to agree to contribute to this administration's pro-corporate agenda.  And it is naive in the extreme to believe that the gop and trump won't attack her with the same ferocity and with the same set of lies, no matter what she does with NAFTA2.",103926358,103926358,<br\//>,comment,1575305859,1,False,False,,,103926358,,0,0,[],0,approved,0,1575310989,Julie,78101368,Washington DC,NULL,NULL
29,4,1575310985,"The reporters' slant, that it is all a political game, is atrocious.

Once again, the much underestimated and maligned Nancy Pelosi is using her power to push the Trump administration, which is desperate for win, to include labor and environmental protections that Democrats have been fighting to include in trade agreements for years",103926776,103926776,<br\//>,comment,1575307258,1,False,False,,,103926776,,1,0,[],0,approved,0,1575316247,Lynn,337474,New York,NULL,NULL
30,5,1575310985,"Go for it, Dems. Just make sure you repeat, over and over again, and then over and over some more, how you are serving the people, not your party or politics. Contrast your willingness to get something done with the Republicans’ complete lack of cooperation on any legislation the Democrats pass.",103926823,103926823,<br\//>,comment,1575307400,1,False,False,,,103926823,,0,0,[],0,approved,0,1575310985,Jim,79269717,Iowa,NULL,NULL
31,6,1575306303,I am a west coast liberal and I say get this agreement done. It will be good for the country and will help establish the fairness of the democratic party.. We are always doing what is best for the country.,103926177,103926177,<br\//>,comment,1575305220,1,False,False,,,103926177,https://s3.amazonaws.com/pimage.timespeople.nytimes.com/avatars/cropped-bae210f2d68c5cfe7c3810748cc6d1c6791ff7e77cf08a77f1350380a2999bdf.jpg,10,0,[],0,approved,0,1575342257,westcoaststeve,53277030,seattle,NULL,NULL
32,7,1575306297,The Dems should pass this if it is a good bill.  Don't fall into Trump's trap and demonize everything about him and the GOP.  This is government and should operate as such.  Go high on this one.,103926112,103926112,<br\//>,comment,1575305019,1,False,False,,,103926112,,11,0,[],0,approved,0,1575342268,Kathy Shields,80917929,CA,NULL,NULL
33,8,1575306293,Pelosi is wise to wait for Trump's agreed terms in writing! Trump has talked out of both sides of his mouth on virtually every issue. The only hope of avoiding more chaos and confusion is to get it in writing.,103926060,103926060,<br\//>,comment,1575304873,1,False,False,,,103926060,,7,0,[],0,approved,0,1575312667,CC,67377764,NYC,NULL,NULL
34,9,1575305393,"While there is some risk that the Democrats will give Trump a victory, there is a better chance that they too will win, and perhaps a bigger victory in the long run. The Democrats need to prove to Americans that they care about them, and especially their economic well being. Trade deals like NAFTA were one of the primary assaults on the working and middle class, and why finally, many of them turned on the Dems and voted for Trump. 

It may be necessary to push for some further protections for jobs and wages under this new version, but they shouldn't practice partisanship on it, otherwise they risk cutting their noses off to spite their faces. We've lived under a ""winner take all"" political environment for so long, most have forgotten what a bi-partisan ""win"" looks like. This would be one of those all but extinct creatures.

And passing this bill would go a long way toward proving to those who simply see this impeachment effort as the Democrats just trying to do anything they can to hurt Trump. But giving him a ""win"" would poke a hole in that belief.

Frankly, this bill does not go nearly far enough in helping the American workers, but it's a good step in the right direction, and might well provide momentum for further progress.",103925819,103925819,<br\//>,comment,1575304121,1,True,False,,,103925819,https://s3.amazonaws.com/pimage.timespeople.nytimes.com/avatars/cropped-4d355eebe71378858dd72b8cc060cc3d92060637eba26126a14e05e0c5a4bc83.jpg,51,0,"[{'commentID': 103927181, 'status': 'approved', 'commentSequence': 103927181, 'userID': 56792725, 'userDisplayName': 'cynic2', 'userLocation': 'Missouri', 'userTitle': 'NULL', 'userURL': 'NULL', 'picURL': None, 'commentTitle': '<br\\//>', 'commentBody': ""@Kingfish52   ...  Thank You, Thank You, for your eloquent comment.  Very much appreciated.  \nI'm too disgusted to think/write that well right now. So, thanks again."", 'createDate': '1575308529', 'updateDate': '1575326873', 'approveDate': '1575310993', 'recommendations': 4, 'replyCount': 0, 'replies': [], 'editorsSelection': False, 'parentID': 103925819, 'parentUserDisplayName': 'Kingfish52', 'depth': 2, 'commentType': 'userReply', 'trusted': 0, 'recommendedFlag': 0, 'permID': '103927181', 'isAnonymous': False}]",1,approved,0,1576682848,Kingfish52,73348263,Rocky Mountains,NULL,NULL
35,10,1575305388,"As for Trumps role...a broken clock is correct twice a day. Doesn't mean you shouldn't toss it out and get a new one. We need a new model of POTUS. No matter how much better NAFTA 2.0 ends up. Nixon got some truly good things done too, but we don't need a Nixon 2.0 either. 

Also, lets come to grips with the facts that Trump adds little to these deals. Sure he might toss in a chip or two, like the Rx drugs part, but that's not his real input, those are other peoples words and wishes. He's not the devil in the details, he's the Devil outside the room, who could kill anything good from this deal with a few tweets. 

Who's in the pool, that when this thing arrives on Trump's desk, he somehow fumbles it, and loses the win...? I'm in for a $100.",103925860,103925860,<br\//>,comment,1575304238,1,False,False,,,103925860,https://s3.amazonaws.com/pimage.timespeople.nytimes.com/avatars/cropped-4edced9367278dca2d92f3b4927c25ef2cbf0e4ca698bce6365f03d12fbf1399.jpg,5,0,[],0,approved,0,1575309031,Boregard,73746179,NYC,NULL,NULL
36,11,1575305381,It's hard to trust anything the lying 45 says. I trust Nancy Pelosi to do what's right. There has been no democratic input so hopefully the misleading headlines will not dominate the facts.,103925596,103925596,<br\//>,comment,1575303392,1,False,False,,,103925596,,2,0,[],0,approved,0,1575331184,Marylee,41736033,MA,NULL,NULL
