,index,approveDate,commentBody,commentID,commentSequence,commentTitle,commentType,createDate,depth,editorsSelection,isAnonymous,parentID,parentUserDisplayName,permID,picURL,recommendations,recommendedFlag,replies,replyCount,status,trusted,updateDate,userDisplayName,userID,userLocation,userTitle,userURL
39,14,1575399164,"This is humorous, honest, insightful and encouraging. It seems to be about connecting without a full embrace. Sharing just a bit of oneself without stripping down entirely. At the same time, dipping the toes into the water to experience something different. However and wherever you go, I'll be applauding.",103948274,103948274,<br\//>,comment,1575399158,1,False,False,,,103948274,,49,0,[],0,approved,0,1575575587,Brad,18779605,Maryland,NULL,NULL
40,15,1575397565,"Amy, well done. I know what you mean when you say that you don't know why you keep going back to the mic's; and that perhaps it is a sense of community/fellowship with fellow-mic'ers.

Though I was singing and playing guitar for many years, it was only when I got past the age of 60 that I plucked up the courage to perform in public.

Last year I found an ('all ages') open mic in my town and I've become a regular there - performing and trying out songs. I keep going back because the community there is supportive. I'm old enough to be their father or grandfather, yet they greet me warmly and cheer me on each time I perform.

Lovely feeling.

Yes, I do some gigs now (some paid, some not) -- and I keep returning to my open mic spot because I'm most comfortable there.

Keep going, Amy.",103947447,103947447,<br\//>,comment,1575397564,1,False,False,,,103947447,,71,0,[],0,approved,0,1575983536,Ceteris Paribus,72722081,Nomatterwhere,NULL,NULL
41,16,1575397465,"Dear Amy
Thanks for writing this article.  I would love to come and see you perform (and pay for it to boot)!  Wishing you all the best in your new career.
From,
A fellow professional mom of 2 daughters",103947398,103947398,<br\//>,comment,1575397464,1,False,False,,,103947398,,71,0,[],0,approved,0,1587918695,Charmaine,89966641,New York City,NULL,NULL
