,index,approveDate,commentBody,commentID,commentSequence,commentTitle,commentType,createDate,depth,editorsSelection,isAnonymous,parentID,parentUserDisplayName,permID,picURL,recommendations,recommendedFlag,replies,replyCount,status,trusted,updateDate,userDisplayName,userID,userLocation,userTitle,userURL
69,19,1575337064,"I fully agree that we need to close the holding facilities that have been built for illegal immigrants.  Over the last 30 years, I have lived and worked in 8 other countries. None of these countries had similar facilities.  In every case, illegal immigrants were immediately deported back to their home country. This worked very well and I strongly believe that we should also adopt this practice.",103934100,103934100,<br\//>,comment,1575337063,1,False,False,,,103934100,,23,0,[],0,approved,0,1584807028,David,73294463,Houston,NULL,NULL
70,20,1575336810,So American taxpayers are supposed to pay billions to help the people who illegally came into the country figure out a way to stay here instead of locking them up and potentially sending them back?  It's that sort of thinking that will keep Trump in office.,103934047,103934047,<br\//>,comment,1575336810,1,False,False,,,103934047,,69,0,"[{'commentID': 103935743, 'status': 'approved', 'commentSequence': 103935743, 'userID': 66771657, 'userDisplayName': 'Ted', 'userLocation': 'NY', 'userTitle': 'NULL', 'userURL': 'NULL', 'picURL': None, 'commentTitle': '<br\\//>', 'commentBody': '@Chris     You can spend unending billions to house the poor in hotels, or you can build affordable housing.   The point being that there are logical and practical solutions, demagogic arguments are not it!', 'createDate': '1575346935', 'updateDate': '1575390579', 'approveDate': '1575346935', 'recommendations': 3, 'replyCount': 0, 'replies': [], 'editorsSelection': False, 'parentID': 103934047, 'parentUserDisplayName': 'Chris', 'depth': 2, 'commentType': 'userReply', 'trusted': 0, 'recommendedFlag': 0, 'permID': '103935743', 'isAnonymous': False}, {'commentID': 103935956, 'status': 'approved', 'commentSequence': 103935956, 'userID': 69545768, 'userDisplayName': 'sam finn', 'userLocation': 'california', 'userTitle': 'NULL', 'userURL': 'NULL', 'picURL': None, 'commentTitle': '<br\\//>', 'commentBody': '@Ted \n\nSpending billions of our dollars to help our own citizens is one thing.\n\nTotally different is spending billions of our dollars to help/encourage/allow 7 billion people in the rest of the world come here.', 'createDate': '1575348530', 'updateDate': '1584807059', 'approveDate': '1575348531', 'recommendations': 29, 'replyCount': 0, 'replies': [], 'editorsSelection': False, 'parentID': 103935743, 'parentUserDisplayName': 'Chris', 'depth': 2, 'commentType': 'userReply', 'trusted': 0, 'recommendedFlag': 0, 'permID': '103935956', 'isAnonymous': False}, {'commentID': 103935112, 'status': 'approved', 'commentSequence': 103935112, 'userID': 56972753, 'userDisplayName': 'Carla', 'userLocation': 'Brooklyn', 'userTitle': 'NULL', 'userURL': 'NULL', 'picURL': None, 'commentTitle': '<br\\//>', 'commentBody': '@Chris \nIt is a crime to lock up someone for no reason, in this case civil cases.\nSomeone seeking asylum for whatever reason is not a criminal.\nThe lack of compassion in these comments is sickening .\nI never knew my fellow Americans were this hateful.\nBy the way, the largest immigrant groups in the USA are Canadians and Irish.\nI don’t see anyone deporting them.', 'createDate': '1575342963', 'updateDate': '1575392073', 'approveDate': '1575392073', 'recommendations': 0, 'replyCount': 0, 'replies': [], 'editorsSelection': False, 'parentID': 103934047, 'parentUserDisplayName': 'Chris', 'depth': 2, 'commentType': 'userReply', 'trusted': 0, 'recommendedFlag': 0, 'permID': '103935112', 'isAnonymous': False}]",3,approved,0,1584807043,Chris,59841589,Charlotte,NULL,NULL
71,21,1575335374,"All the endless advocacy articles on immigration are not going to change the facts on the ground.  ..what people see with their own eyes. Those facts are that they see their wages being depressed and jobs taken by immigrants that would be done by unemployed here.

...and, if this were not so, why do you think there is not universal acceptance of E-verify?  If employers really wanted to hire local, they would use this program which currently, in most places, is voluntary.  Instead, they want to claim labor shortages, etc. and invent all sorts of legal ways to bring in more labor.",103933760,103933760,<br\//>,comment,1575335373,1,False,False,,,103933760,,54,0,"[{'commentID': 103935841, 'status': 'approved', 'commentSequence': 103935841, 'userID': 66771657, 'userDisplayName': 'Ted', 'userLocation': 'NY', 'userTitle': 'NULL', 'userURL': 'NULL', 'picURL': None, 'commentTitle': '<br\\//>', 'commentBody': '@Blanche White        The article is not an advocacy on illegal immigration, but smart planning and spending.   Not sure what mythological jobs are being negated to the unemployed in favor of immigrants.    As far as been reported, not many people want to pick up letters or work on slaughter houses, or clean hotel rooms, or wash dishes.  Indeed, conditions in slaughter houses (60 Minutes program) are said to be so unhealthy that deaths and other illnesses are being adjudicated in court.      One profession that has grown exponentially since the 1990s  is security guards, used in “private jails”, to guard properties of the super rich and so on.', 'createDate': '1575347675', 'updateDate': '1575385739', 'approveDate': '1575349747', 'recommendations': 3, 'replyCount': 0, 'replies': [], 'editorsSelection': False, 'parentID': 103933760, 'parentUserDisplayName': 'Blanche White', 'depth': 2, 'commentType': 'userReply', 'trusted': 0, 'recommendedFlag': 0, 'permID': '103935841', 'isAnonymous': False}, {'commentID': 103936197, 'status': 'approved', 'commentSequence': 103936197, 'userID': 75999930, 'userDisplayName': 'Eye by the Sea', 'userLocation': 'California', 'userTitle': 'NULL', 'userURL': 'NULL', 'picURL': None, 'commentTitle': '<br\\//>', 'commentBody': '@Ted \n\nThe conditions in slaughterhouses are so bad precisely because illegal labor has broken the unions that once upheld safety standards.', 'createDate': '1575351038', 'updateDate': '1584807152', 'approveDate': '1575351038', 'recommendations': 18, 'replyCount': 0, 'replies': [], 'editorsSelection': False, 'parentID': 103935841, 'parentUserDisplayName': 'Blanche White', 'depth': 2, 'commentType': 'userReply', 'trusted': 0, 'recommendedFlag': 0, 'permID': '103936197', 'isAnonymous': False}, {'commentID': 103936360, 'status': 'approved', 'commentSequence': 103936360, 'userID': 92937493, 'userDisplayName': 'Andrew', 'userLocation': 'MA', 'userTitle': 'NULL', 'userURL': 'NULL', 'picURL': None, 'commentTitle': '<br\\//>', 'commentBody': 'I share your concerns about the effects of immigration on labor.  There’s some evidence of wage depression, caused by a labor force that can be easily exploited.  Not only does business exploitation of undocumented migrants lower wages in some places, it lowers compliance with workplace safety and other rules, and creates a general atmosphere of noncompliance with labor laws. Someone who fears deportation is way less likely to unionize, so this makes unions weaker as well.  This is what the rich want.  \n\nIt seems the answer is to ensure that immigrant labor can’t be exploited. The best way to do this is to remove the threat of deportation from undocumented workers so that employers can’t hold that over their heads when those workers want to unionize sud for unpaid wages, or simply have the freedom to move on to another job. By ensuring that every human in the United States who works has the same rights in the workplace, and the ability to enforce them in court, you would make life better for everyone and eliminate the incentive to import labor.  Employer sanctions, e-verify, none of that nonsense has made a difference: corporations will go on exploiting labor until people can stand up to them.', 'createDate': '1575352688', 'updateDate': '1576302485', 'approveDate': '1575352689', 'recommendations': 4, 'replyCount': 0, 'replies': [], 'editorsSelection': False, 'parentID': 103933760, 'parentUserDisplayName': 'Blanche White', 'depth': 2, 'commentType': 'userReply', 'trusted': 0, 'recommendedFlag': 0, 'permID': '103936360', 'isAnonymous': False}]",5,approved,0,1584807129,Blanche White,85385264,South Carolina,NULL,NULL
72,22,1575335186,"So it's OK to break the law if you're one of these migrants?  So we should simply let them stay in this country and get free medical care, education, housing. etc?

This does not sit well with law-abiding, hard working Americans.",103933540,103933540,<br\//>,comment,1575334238,1,False,False,,,103933540,,80,0,[],0,approved,0,1584807196,simon,40637512,MA,NULL,NULL
73,23,1575335183,"Wouldn't have to lock them up if we stopped allowing them to cross the border to begin with. So let them all out tomorrow if you want, just as long as they are released in the countries they came from. Not willing to do that, build more prisons.",103930621,103930621,<br\//>,comment,1575320886,1,False,False,,,103930621,,56,0,[],0,approved,0,1584807206,GregP,80793664,27405,NULL,NULL
74,24,1575335183,"How many people will the learned professor keep at his home, and be responsible for feeding them, taking care of them, and agreeing to be sued if something untoward were to happen to them?",103930965,103930965,<br\//>,comment,1575322151,1,False,False,,,103930965,,54,0,"[{'commentID': 103940086, 'status': 'approved', 'commentSequence': 103940086, 'userID': 40637512, 'userDisplayName': 'simon', 'userLocation': 'MA', 'userTitle': 'NULL', 'userURL': 'NULL', 'picURL': None, 'commentTitle': '<br\\//>', 'commentBody': '@Albela Shaitan \nYes, the writer of this piece should definitely take in a family or two before he chastises the rest of the country!', 'createDate': '1575381558', 'updateDate': '1584807213', 'approveDate': '1575404600', 'recommendations': 2, 'replyCount': 0, 'replies': [], 'editorsSelection': False, 'parentID': 103930965, 'parentUserDisplayName': 'Albela Shaitan', 'depth': 2, 'commentType': 'userReply', 'trusted': 0, 'recommendedFlag': 0, 'permID': '103940086', 'isAnonymous': False}]",1,approved,0,1584807210,Albela Shaitan,38777396,Midwest,NULL,NULL
75,0,1575335183,"Mr. Hernández argues we should shut down immigrant prisons, and where do the inmates go? The other issue he simply does not delineate between ILLEGAL immigrants and LEGAL immigrants; instead, falling back on a cover-all word 'migrants.'  This is classic NYT. 

These are migrants, mostly economic migrants despite what Trump says, but they are breaking the United State's law. As such, we should have prisons for them. Americans like legal immigration. Even legal immigrants from other countries do not like illegal immigrants. The rule of law is a blunt hammer, and when Democrats raise their hands for free healthcare for illegals or argue differently, they're setting us up for a Trump 2020.

Oddly, it's like they all know the gig: pay for a coyote to transport them, apply for asylum (with a 2% approval rate), hope to get into a log-jammed judicial system, sap American resources and stay. Luckily, Trump has decided to keep them in Mexico while they wait. 

Sorry, no remorse.",103931253,103931253,<br\//>,comment,1575323241,1,False,False,,,103931253,,56,0,[],0,approved,0,1584807288,Scott,69151106,"Scottsdale,AZ",NULL,NULL
76,1,1575335183,I agree with the headline. All undocumented people should be immediately deported. PaulN (came legally over 40 years ago),103932061,103932061,<br\//>,comment,1575326784,1,False,False,,,103932061,,52,0,[],0,approved,0,1584807294,PaulN,96589406,"Columbus, Ohio, US of A",NULL,NULL
77,2,1575335183,"The fact that 11 million people who are here illegally commit crimes at the same rate as citizens is a perfected example of poor use of statistics. Why would I want 4 percent more murders or rapes to happen in my country to accommodate these people? The real problem is that we are unable to efficiently find and deport these people. In some cases it's because they have a legitimate claim (about 10 percent) for refugee treatment, the other 90 percent are just here to make money.",103932537,103932537,<br\//>,comment,1575328904,1,False,False,,,103932537,,42,0,[],0,approved,0,1584807305,Ross Salinger,48135215,Carlsbad California,NULL,NULL
78,3,1575335182,"""Dwight Eisenhower’s attorney general, Herbert Brownell Jr., announced a decision to shut down major immigration detention centers along both coasts, including Ellis Island.”

I question your depiction of Eisenhower and his attorney general.

Truman’s attorney general, Herbert Brownell, implemented an immigration enforcement program in which more than 127,000 illegal Mexican migrants were formally deported to Mexico and another 3.2 million were induced to leave voluntarily rather than face deportation.

In 1951, Truman signed legislation which allowed farmers to employ Mexicans on a temporary basis, in the Bracero Program, as long as they returned to their families, in Mexico, at the end of the season.  But he did not want Mexicans or other foreigners coming here to live permanently, without our permission.  

According to a 7/9/10 post on Factcheck titled “Hoover, Truman, & Ike: Mass Deporters?"", Truman said, ""These people are coming to our country in phenomenal numbers – and at an increasing rate,"" Truman said. ""Everyone suffers from the presence of these illegal immigrants in the community.”  

The article also said, ""Truman actually wanted to do more than he was able to stem illegal immigration.”  ",103933354,103933354,<br\//>,comment,1575333145,1,False,False,,,103933354,,24,0,[],0,approved,0,1575392315,ann,8926818,Seattle,NULL,NULL
79,4,1575335181,"While it is horrific that we imprison these individuals in such horrible conditions, and especially ones seeking asylum to escape dangerous situations, what adds insult to injury is the economic divide between undocumented immigrants where millions are living here with no repercussions because they were able to afford to enter our country on vacation visas:

<a href=""https://www.nytimes.com/2019/12/01/us/undocumented-visa-overstays.html"" target=""_blank"">https://www.nytimes.com/2019/12/01/us/undocumented-visa-overstays.html</a>

“ Nearly half of the estimated 11 million undocumented immigrants now in the country did not trek through the desert or wade across the Rio Grande to enter the country; they flew in with a visa, passed inspection at the airport — and stayed.”",103930598,103930598,<br\//>,comment,1575320795,1,False,False,,,103930598,,11,0,"[{'commentID': 103934185, 'status': 'approved', 'commentSequence': 103934185, 'userID': 8926818, 'userDisplayName': 'ann', 'userLocation': 'Seattle', 'userTitle': 'NULL', 'userURL': 'NULL', 'picURL': None, 'commentTitle': '<br\\//>', 'commentBody': '@Bronx Jon \nThe article you refer to told about an industrial engineer who overstayed his vacation visa.  It also referred to foreigners who had not returned to their home countries after graduating from U.S. universities.  These educated people are not given preference by our immigration system.  Unlike Canada which accepts about two-thirds of its non-refugee immigrants on a merit-based point system, we, in the U.S., ignore merit for about two-thirds of our immigrants - to look only at kinship.  \n\nCanada gives points for having an education/ skill that would benefit the Canadian economy.  It also gives points for fluency in English and/or French, and for an overall ability to assimilate into Canadian culture.   All the United States Immigration system cares about is whether the applicant has a relative, such as a brother or sister-in-law, who is already living here.\n\nWe need to drastically change our immigration system to resemble Canada’s.  This would allow us to accept industrial engineers and more graduates of our own universities.', 'createDate': '1575337551', 'updateDate': '1584807347', 'approveDate': '1575337553', 'recommendations': 28, 'replyCount': 0, 'replies': [], 'editorsSelection': False, 'parentID': 103930598, 'parentUserDisplayName': 'Bronx Jon', 'depth': 2, 'commentType': 'userReply', 'trusted': 0, 'recommendedFlag': 0, 'permID': '103934185', 'isAnonymous': False}, {'commentID': 103934440, 'status': 'approved', 'commentSequence': 103934440, 'userID': 95731640, 'userDisplayName': 'Bronx Jon', 'userLocation': 'NYC', 'userTitle': 'NULL', 'userURL': 'NULL', 'picURL': None, 'commentTitle': '<br\\//>', 'commentBody': '@ann Agreed.\n\nMy point was that it is hypocritical of us to discriminate against individuals who break our immigration laws just because they climbed over a fence rather than arrived by plane.', 'createDate': '1575339021', 'updateDate': '1575390818', 'approveDate': '1575339022', 'recommendations': 9, 'replyCount': 0, 'replies': [], 'editorsSelection': False, 'parentID': 103934185, 'parentUserDisplayName': 'Bronx Jon', 'depth': 2, 'commentType': 'userReply', 'trusted': 0, 'recommendedFlag': 0, 'permID': '103934440', 'isAnonymous': False}, {'commentID': 103935984, 'status': 'approved', 'commentSequence': 103935984, 'userID': 69545768, 'userDisplayName': 'sam finn', 'userLocation': 'california', 'userTitle': 'NULL', 'userURL': 'NULL', 'picURL': None, 'commentTitle': '<br\\//>', 'commentBody': ""@Bronx Jon \n\nHalf of all visa overstays are Latin Americans --\nthat's on top of the border jumpers -- nearly all Latins.\nResult -- 3/4 of all illegals are Latin Americans.\n\nIllegal immigration is overwhelming Latin American."", 'createDate': '1575348796', 'updateDate': '1584807354', 'approveDate': '1575392431', 'recommendations': 1, 'replyCount': 0, 'replies': [], 'editorsSelection': False, 'parentID': 103930598, 'parentUserDisplayName': 'Bronx Jon', 'depth': 2, 'commentType': 'userReply', 'trusted': 0, 'recommendedFlag': 0, 'permID': '103935984', 'isAnonymous': False}]",3,approved,0,1575390789,Bronx Jon,95731640,NYC,NULL,NULL
80,5,1575335181,Ending enforcement of immigration laws eventually would lead to a solution of the whole problem of illegal entry into the U.S.  After a few hundred million more migrants take up residence in the country there will no longer be a reason for anyone else to come.,103930814,103930814,<br\//>,comment,1575321600,1,False,False,,,103930814,,32,0,[],0,approved,0,1584807360,PWR,66600126,Malverne,NULL,NULL
81,6,1575335181,If Democrats would get onboard with Mr. Trump's plans to end unwanted illegal immigration we could close immigration prisons as they would then be unneeded.,103930876,103930876,<br\//>,comment,1575321844,1,False,False,,,103930876,,35,0,[],0,approved,0,1584807371,Ronald B. Duke,84070249,"Oakbrook Terrace, Il.",NULL,NULL
82,7,1575335181,"But what do you do with the immigrants while their cases are being adjudicated?  The article doesn't focus on that, but the left's goal is clear: they want immigrants to come here unrestricted, and then released into the interior of the U.S., with a court date at some point down the line, say two or three years.  (Reason enough to try to enter illegally, if you're guaranteed a 3 year stay and get work in the meantime.) And of course, if the immigrant does not show up for the court date, there is no enforcement mechanism, because of course people like the authors will object to 'rounding them up.' (And cue all the ""studies"" from liberal think tanks which will claim that immigrants show up for court dates more often than citizens!)  Combine all of this with the Dems' desire to decriminalize illegal entries, and you basically have open borders.  Remember that the next time the media tells you that ""open borders"" is a myth.",103931531,103931531,<br\//>,comment,1575324393,1,False,False,,,103931531,,42,0,[],0,approved,0,1584807376,R.P.,66703836,"Bridgewater, NJ",NULL,NULL
83,8,1575335181,"Immigration detention is cruel and immoral. Immigrants we detain in horrific conditions include: (a) lawful permanent residents who are being stripped of their status because of some minor crime; (b) asylum applicants; (c) families with children; (d) working immigrants stopped by local police and turned into ICE.  No one deserves to be shackled and frozen, given rotten food, subject to solitary confinement and extreme medical neglect, all without a definitive date for release. This evil system thrives in order to put money in the pockets of private prison contractors and local jails who want to make an extra buck on the suffering of black and brown families. The cost falls entirely on the poorest and most vulnerable people. We should be ashamed.",103932084,103932084,<br\//>,comment,1575326896,1,False,False,,,103932084,,6,0,[],0,approved,0,1575390860,RB,63517588,New York,NULL,NULL
84,9,1575335181,"I agree lets abolish immigration prisons and simply quickly and efficiently repatriate people who have no legal right to live in this country, along with those whose asylum claims have a low likelihood of success to their country of origin.  In the low likely hood the courts decide in their favor they can come back and enter legally.  

Or were y'all actually just trying to argue for an open borders policy without actually writing the words?",103933340,103933340,<br\//>,comment,1575333066,1,False,False,,,103933340,,43,0,[],0,approved,0,1584807400,I want another option,32819958,America,NULL,NULL
85,10,1575335181,"I assume César Cuauhtémoc García Hernández has never been to Texas.

I invite him to come and see the problems in person.

I expect he will then agree that immigration enforcement needs to be increased, not lessened.",103933536,103933536,<br\//>,comment,1575334213,1,False,False,,,103933536,,34,0,[],0,approved,0,1584807415,Steve Smith,62296073,"Austin, Texas",NULL,NULL
86,11,1575335180,Trump's argument for these intentionally cruel detentions is that it deters more people from coming.  He and his racist minions have no clue of the horrors that Central Americans and others are fleeing from.    I am  ashamed and angry about what is being done in my name as an American.  This has to stop.,103930571,103930571,<br\//>,comment,1575320698,1,False,False,,,103930571,,6,0,"[{'commentID': 103940367, 'status': 'approved', 'commentSequence': 103940367, 'userID': 71704641, 'userDisplayName': 'Ali', 'userLocation': 'Michigan', 'userTitle': 'NULL', 'userURL': 'NULL', 'picURL': None, 'commentTitle': '<br\\//>', 'commentBody': '@Suzanne Wheat -- Who\'s creating those ""horrors""?  Maybe, CENTRAL AMERICANS?  And they\'re doing the same thing here--MS-13 is on the rise here again, and the recent death of an Hispanic teen in Maryland is attributed to gangs.', 'createDate': '1575382239', 'updateDate': '1584807425', 'approveDate': '1575392077', 'recommendations': 2, 'replyCount': 0, 'replies': [], 'editorsSelection': False, 'parentID': 103930571, 'parentUserDisplayName': 'Suzanne Wheat', 'depth': 2, 'commentType': 'userReply', 'trusted': 0, 'recommendedFlag': 0, 'permID': '103940367', 'isAnonymous': False}, {'commentID': 103933887, 'status': 'approved', 'commentSequence': 103933887, 'userID': 85385264, 'userDisplayName': 'Blanche White', 'userLocation': 'South Carolina', 'userTitle': 'NULL', 'userURL': 'NULL', 'picURL': None, 'commentTitle': '<br\\//>', 'commentBody': '@Suzanne Wheat \n\nI just read, today, that the city of Baltimore has a higher murder rate than any of these Central American Countries.', 'createDate': '1575336022', 'updateDate': '1584807434', 'approveDate': '1575402897', 'recommendations': 2, 'replyCount': 0, 'replies': [], 'editorsSelection': False, 'parentID': 103930571, 'parentUserDisplayName': 'Suzanne Wheat', 'depth': 2, 'commentType': 'userReply', 'trusted': 0, 'recommendedFlag': 0, 'permID': '103933887', 'isAnonymous': False}]",2,approved,0,1575390893,Suzanne Wheat,58806381,North Carolina,NULL,NULL
