,index,approveDate,commentBody,commentID,commentSequence,commentTitle,commentType,createDate,depth,editorsSelection,isAnonymous,parentID,parentUserDisplayName,permID,picURL,recommendations,recommendedFlag,replies,replyCount,status,trusted,updateDate,userDisplayName,userID,userLocation,userTitle,userURL
62,12,1575248424,"As one reader, retired Navy replied, “where are the hero’s that have standards and the moral fiber to say
enough is enough??” .. I too am repulsed by this act,
and the act of holding critical aid, approved by a bi-partisan constituency, the Department of State and the Pentagon to a vulnerable country, Ukraine for personal political gain. We heard from career diplomats and the military alike that withholding this aid was not only undermining Ukraine but Western democracy. There were lives lost during this political errand, and the blood is on our hands.
Where are the Republicans who have standards and the moral fiber to say enough is enough? 
We must be reminded again  that the Ukrainian aid was approved by Department of State and the Pentagon and bipartisan members of Congress. It was approved because Ukraine had provided significant proof in its commitment to fighting and ending corruption, in the words of the US Government. This is not “hearsay” but factual obtainable information from Department of State and the Pentagon. Trumps willful undermining of our revered institutions and the pillars of democracy for personal gain is breaking my spirit to fight for what is right. He has truly brainwashed Republicans- truth, values and standards no longer matter, why?- Secretary of the Navy Spencer in an effort to silence Trump - to stop his vocal/Tweet/Fox News  interference in this highly sensitive case, was reduced to trying to make a side deal, and lost.",103919760,103919760,<br\//>,comment,1575247294,1,False,False,,,103919760,,15,0,[],0,approved,0,1575258575,nytsubscriber,63533808,new york,NULL,NULL
63,13,1575248423,Our military will transcend whatever embarrassments Trump attempts in his pitiful effort to distract the law from bringing the American people the justice due him for his many crimes.,103919664,103919664,<br\//>,comment,1575246436,1,False,False,,,103919664,,4,0,[],0,approved,0,1575291495,Cleareye,25283975,Hollywood,NULL,NULL
64,14,1575248423,"Headline wrong. Politicizing the military is the surest way to end our civilian democracy. Look at Latin America, Africa, even Asia. The armed forces are overwhelmingly powerful and when they get riled up no civilian regime can survive.",103919767,103919767,<br\//>,comment,1575247382,1,False,False,,,103919767,https://s3.amazonaws.com/pimage.timespeople.nytimes.com/avatars/cropped-b5676af5ee21f99ff811cedfaa1d66fca655513bb4b3379c76aaa8d16146baff.jpg,7,0,[],0,approved,0,1575302976,Machiavelli,19815576,Firenze,NULL,NULL
65,15,1575248421,"Obama, like Trump, was absolutely correct to oppose the 2nd Iraq war.",103919533,103919533,<br\//>,comment,1575245143,1,False,False,,,103919533,,0,0,"[{'commentID': 103920368, 'status': 'approved', 'commentSequence': 103920368, 'userID': 76267885, 'userDisplayName': 'Bob Guthrie', 'userLocation': 'Australia', 'userTitle': 'NULL', 'userURL': 'NULL', 'picURL': None, 'commentTitle': '<br\\//>', 'commentBody': '@Dr. John \nTrump did not oppose it in real time. Only later when he saw self interest in so doing. At the time when asked if he supported the war he said ""I guess so"". As a stalwart anti-liberal  yourself, I find it stretches credibility for you to claim now that you opposed it', 'createDate': '1575253764', 'updateDate': '1575271617', 'approveDate': '1575256233', 'recommendations': 4, 'replyCount': 0, 'replies': [], 'editorsSelection': False, 'parentID': 103919533, 'parentUserDisplayName': 'Dr. John', 'depth': 2, 'commentType': 'userReply', 'trusted': 0, 'recommendedFlag': 0, 'permID': '103920368', 'isAnonymous': False}, {'commentID': 103920745, 'status': 'approved', 'commentSequence': 103920745, 'userID': 61584492, 'userDisplayName': 'Dr. John', 'userLocation': 'Seattle', 'userTitle': 'NULL', 'userURL': 'NULL', 'picURL': None, 'commentTitle': '<br\\//>', 'commentBody': '@Bob Guthrie \n\nHillary supported the Iraq War.\n\nIn real time.', 'createDate': '1575259088', 'updateDate': '1575281177', 'approveDate': '1575281177', 'recommendations': 0, 'replyCount': 0, 'replies': [], 'editorsSelection': False, 'parentID': 103920368, 'parentUserDisplayName': 'Dr. John', 'depth': 2, 'commentType': 'userReply', 'trusted': 0, 'recommendedFlag': 0, 'permID': '103920745', 'isAnonymous': False}]",2,approved,0,1575248421,Dr. John,61584492,Seattle,NULL,NULL
66,16,1575248421,"I take it that the media is clueless about how the chain of command works in the military. No matter who the President is, he is still the commander and chief. Trying to undermine is authority will leave military members in prison or killed for treason/Mutiny.",103919754,103919754,<br\//>,comment,1575247268,1,False,False,,,103919754,,1,0,[],0,approved,0,1575255537,Patrick Reid,103095506,"Columbia, SC",NULL,NULL
67,17,1575248420,I’ll side with Navy Seal Gallagher and President Trump over some unelected duplicitous functionaries in the Pentagon any day.,103919498,103919498,<br\//>,comment,1575244903,1,False,False,,,103919498,,2,0,"[{'commentID': 103919908, 'status': 'approved', 'commentSequence': 103919908, 'userID': 88691389, 'userDisplayName': 'Smaug', 'userLocation': 'New Mexico', 'userTitle': 'NULL', 'userURL': 'NULL', 'picURL': None, 'commentTitle': '<br\\//>', 'commentBody': 'Ummmmmm, are you aware that most of the officials at the Pentagon who would have any say in these matters are high-ranking members of the military?', 'createDate': '1575248827', 'updateDate': '1575300897', 'approveDate': '1575252906', 'recommendations': 9, 'replyCount': 0, 'replies': [], 'editorsSelection': False, 'parentID': 103919498, 'parentUserDisplayName': 'JQGALT', 'depth': 2, 'commentType': 'userReply', 'trusted': 0, 'recommendedFlag': 0, 'permID': '103919908', 'isAnonymous': False}]",1,approved,0,1575259338,JQGALT,66742458,Philly,NULL,NULL
68,18,1575248420,Gallagher stood up SEAL strong to  a guy who was shackled and sedated.  You know what.  I’ll bet Trump could have taken that guy out as well. Two GOP heroes.,103919660,103919660,<br\//>,comment,1575246388,1,False,False,,,103919660,,13,0,[],0,approved,0,1575300913,Letsbefrank,65826175,NYC,NULL,NULL
69,19,1575248420,""" Then, without warning, according to colleagues, Chief Gallagher pulled a small hunting knife from a sheath and stabbed the sedated captive in the neck.""

But was found not guilty of this purported offense.

""The highest ranks in the Navy insisted Chief Gallagher be held accountable. Mr. Trump overruled the chain of command and the secretary of the Navy was fired.""

Exactly so. ""Not guilty"". ""Insisted"" in spite of ""not guilty"".

Trump belives in the rule of law, not that of military spite, even in the face of ""not guilty"". 

Gallaher was found guilty of a minor offense that is seldom if even punished so severely. 

Trump did the right thing. This is an example of draining the swamp.",103919716,103919716,<br\//>,comment,1575246920,1,False,False,,,103919716,,1,0,"[{'commentID': 103920062, 'status': 'approved', 'commentSequence': 103920062, 'userID': 77112720, 'userDisplayName': 'Roberta', 'userLocation': 'Kansas City', 'userTitle': 'NULL', 'userURL': 'NULL', 'picURL': None, 'commentTitle': '<br\\//>', 'commentBody': ""@Doug McDonald Good to know that trump and his fanatical followers are defending someone like Gallagher, a guy who's no better than the foreign terrorists who wish to do us harm."", 'createDate': '1575250426', 'updateDate': '1575291622', 'approveDate': '1575256231', 'recommendations': 5, 'replyCount': 0, 'replies': [], 'editorsSelection': False, 'parentID': 103919716, 'parentUserDisplayName': 'Doug McDonald', 'depth': 2, 'commentType': 'userReply', 'trusted': 0, 'recommendedFlag': 0, 'permID': '103920062', 'isAnonymous': False}, {'commentID': 103920729, 'status': 'approved', 'commentSequence': 103920729, 'userID': 68845522, 'userDisplayName': 'Allison', 'userLocation': 'Texas', 'userTitle': 'NULL', 'userURL': 'NULL', 'picURL': None, 'commentTitle': '<br\\//>', 'commentBody': '@Doug McDonald: Gallagher was not found ""not guilty."" He was acquitted of the other charges. ""Acquitted"" does not mean ""not guilty."" It simply means that the jury could not convict him based on the evidence presented. And if you read the Navy Times, it specifically mentions that evidence, including video footage, went missing. There is more to this case than meets the eye.', 'createDate': '1575258908', 'updateDate': '1575291640', 'approveDate': '1575258909', 'recommendations': 3, 'replyCount': 0, 'replies': [], 'editorsSelection': False, 'parentID': 103919716, 'parentUserDisplayName': 'Doug McDonald', 'depth': 2, 'commentType': 'userReply', 'trusted': 0, 'recommendedFlag': 0, 'permID': '103920729', 'isAnonymous': False}]",2,approved,0,1575255590,Doug McDonald,66412263,"Champaign, Illinois",NULL,NULL
70,20,1575248420,"This is one time I'm glad of the Internet's permanence and omnipresence.

I hope the record of Chief Gallagher's conduct follows him to the end of his days.",103919762,103919762,<br\//>,comment,1575247334,1,False,False,,,103919762,,10,0,[],0,approved,0,1575291648,ridgeguy,60655815,No. CA,NULL,NULL
71,21,1575248238,"Thank you very much for publishing this article.

I have learned more from it concerning the United States, its government, and its military than ever I knew before, even though I am a veteran of ten years serving in your military.

Your armed forces have changed radically since I served your country as a commissioned officer.  The acts herein described strongly suggest that no longer would I wish to serve you, nor, given the limitations of my morality, would I be accepted to serve.",103919852,103919852,<br\//>,comment,1575248237,1,False,False,,,103919852,,11,0,[],0,approved,0,1575291672,Frank,87547421,Québec,NULL,NULL
72,22,1575246896,Divide and conquer--that's what Trump does. Now he has opened a rift between many within the military ranks and those in command. How does that make the US stronger?,103919712,103919712,<br\//>,comment,1575246896,1,False,False,,,103919712,,10,0,"[{'commentID': 103919820, 'status': 'approved', 'commentSequence': 103919820, 'userID': 77112720, 'userDisplayName': 'Roberta', 'userLocation': 'Kansas City', 'userTitle': 'NULL', 'userURL': 'NULL', 'picURL': None, 'commentTitle': '<br\\//>', 'commentBody': ""@Carol It doesn't. But it does make our foreign adversaries stronger."", 'createDate': '1575247957', 'updateDate': '1575291687', 'approveDate': '1575248422', 'recommendations': 9, 'replyCount': 0, 'replies': [], 'editorsSelection': False, 'parentID': 103919712, 'parentUserDisplayName': 'Carol', 'depth': 2, 'commentType': 'userReply', 'trusted': 0, 'recommendedFlag': 0, 'permID': '103919820', 'isAnonymous': False}]",1,approved,0,1575291681,Carol,62954700,oregon,NULL,NULL
73,23,1575245986,Thank you to Mr. Phillips and his fellow reporters for keeping this story alive. Thank God for a still free press.,103919614,103919614,<br\//>,comment,1575245986,1,False,False,,,103919614,,21,0,[],0,approved,0,1575291693,mgh1952,59877492,"Charleston, SC",NULL,NULL
74,24,1575245076,"This is a Navy Seals issue; let them stand up, speak out to defend their reputation.",103919447,103919447,<br\//>,comment,1575244513,1,False,False,,,103919447,,11,0,[],0,approved,0,1575291705,Bob Newman,64811928,"New York, N.Y.",NULL,NULL
75,0,1575245074,"Just want to throw out a remembrance to LT Mike Murphy, a Navy SEAL who refused to kill an unarmed civilian.  He paid dearly, as did many others, but that is the type of sacrifice we can memorialize and be proud of in this country.",103919432,103919432,<br\//>,comment,1575244341,1,False,False,,,103919432,,30,0,[],0,approved,0,1575600713,RJ,58889023,RI,NULL,NULL
76,1,1575245073,"@Bengals Fan- Chelsea Manning was convicted for revealing atrocities like the ones committed by Gallagher. Unlike Gallagher, no one died. I do not defend Manning, the comparison is not of two equal crimes",103918941,103918941,<br\//>,comment,1575239939,1,False,False,,,103918941,,7,0,"[{'commentID': 103919708, 'status': 'approved', 'commentSequence': 103919708, 'userID': 93266712, 'userDisplayName': 'Bengals Fan', 'userLocation': 'Ohio', 'userTitle': 'NULL', 'userURL': 'NULL', 'picURL': None, 'commentTitle': '<br\\//>', 'commentBody': '@Non Poll \n\nGallagher did not kill anyone. He was convicted of taking a photo.', 'createDate': '1575246871', 'updateDate': '1575257434', 'approveDate': '1575248421', 'recommendations': 1, 'replyCount': 0, 'replies': [], 'editorsSelection': False, 'parentID': 103918941, 'parentUserDisplayName': 'Non Poll', 'depth': 2, 'commentType': 'userReply', 'trusted': 0, 'recommendedFlag': 0, 'permID': '103919708', 'isAnonymous': False}]",1,approved,0,1575600721,Non Poll,45179204,CA,NULL,NULL
77,2,1575245073,"All soldiers cannot obey an unlawful order. Any Commander in Chief who pardons murder especially an immoral act on the battlefield, cannot be obeyed. We tried Nazis who obeyed their Commanders and they were hung or imprisoned. All soldiers have a duty to protect country and our Constitution but our values mean nothing if the Generals and Admirals obey without a conscience. This is why War is so hard on our soldiers because they will have to deal with their conscience afterwards. Our Generals also have a duty to our soldiers to provide a moral standard through leadership and to conduct themselves as an officer. If the Generals obey this President then the soldiers can question their leadership. Czar Putin's plan is going well, divide the military between those who will follow blindly and those who follow the law. We are in dangerous times.",103919100,103919100,<br\//>,comment,1575241040,1,False,False,,,103919100,,20,0,[],0,approved,0,1575274916,amrcitizen16,71822111,NV,NULL,NULL
78,3,1575245073,"If you excuse, pardon or forgive, as the president did, or extol, praise or glorify a war criminal and war crime, as Fox News did, does that not make you a collaborator or accomplice or confederate to that war crime and war criminal?
And therefore at least an accessory after the fact, in not a co-conspirator even a war criminal too?
Just asking.",103919187,103919187,<br\//>,comment,1575241951,1,False,False,,,103919187,,19,0,[],0,approved,0,1575274936,Steven Blair,64680213,"Napa In Como, Italy Now",NULL,NULL
79,4,1575245072,"Thought it might be a good idea to add some truth to this paragraph “He was limp and dusty from an explosion, conscious but barely. A far cry from the fierce, masked Islamic State fighters who once seized vast swaths of Iraq and Syria, the captive was a scraggly teenager in a tank top with limbs so thin that his watch slid easily off his wrist” who would have gladly beheaded any one of our troops if he was given the opportunity.",103919310,103919310,<br\//>,comment,1575243212,1,False,False,,,103919310,https://s3.amazonaws.com/pimage.timespeople.nytimes.com/avatars/uncropped-aee2f460d3160bb4235c7ec37b9c52b16d046843e4590adbad3683d2a444b7c8.jpg,4,0,"[{'commentID': 103919807, 'status': 'approved', 'commentSequence': 103919807, 'userID': 63895002, 'userDisplayName': 'dlhicks', 'userLocation': 'a lot of places', 'userTitle': 'NULL', 'userURL': 'NULL', 'picURL': None, 'commentTitle': '<br\\//>', 'commentBody': 'You may well be right about the kid and what he would have done, and if so he would have been just as bad and wrong as this SEAL.', 'createDate': '1575247790', 'updateDate': '1575600759', 'approveDate': '1575248420', 'recommendations': 7, 'replyCount': 0, 'replies': [], 'editorsSelection': False, 'parentID': 103919310, 'parentUserDisplayName': 'John Gilday', 'depth': 2, 'commentType': 'userReply', 'trusted': 0, 'recommendedFlag': 0, 'permID': '103919807', 'isAnonymous': False}, {'commentID': 103919626, 'status': 'approved', 'commentSequence': 103919626, 'userID': 73317551, 'userDisplayName': 'John Harper', 'userLocation': 'Carlsbad, CA', 'userTitle': 'NULL', 'userURL': 'NULL', 'picURL': None, 'commentTitle': '<br\\//>', 'commentBody': '@John Gilday \n\nSo, we should be no better than them?   No wonder we have Trump.', 'createDate': '1575246072', 'updateDate': '1575600762', 'approveDate': '1575248421', 'recommendations': 12, 'replyCount': 0, 'replies': [], 'editorsSelection': False, 'parentID': 103919310, 'parentUserDisplayName': 'John Gilday', 'depth': 2, 'commentType': 'userReply', 'trusted': 0, 'recommendedFlag': 0, 'permID': '103919626', 'isAnonymous': False}, {'commentID': 103919713, 'status': 'approved', 'commentSequence': 103919713, 'userID': 66805340, 'userDisplayName': 'Al', 'userLocation': 'Pleasanton CA', 'userTitle': 'NULL', 'userURL': 'NULL', 'picURL': None, 'commentTitle': '<br\\//>', 'commentBody': 'and you know this how?', 'createDate': '1575246906', 'updateDate': '1575600764', 'approveDate': '1575250882', 'recommendations': 4, 'replyCount': 0, 'replies': [], 'editorsSelection': False, 'parentID': 103919310, 'parentUserDisplayName': 'John Gilday', 'depth': 2, 'commentType': 'userReply', 'trusted': 0, 'recommendedFlag': 0, 'permID': '103919713', 'isAnonymous': False}]",5,approved,0,1575257485,John Gilday,3553985,Nevada,NULL,NULL
80,5,1575245071,"After you get done putting Bush, Cheney, and Rumsfeld on trial, come and talk to me about CPO Gallagher.",103918899,103918899,<br\//>,comment,1575239618,1,False,False,,,103918899,,3,0,[],0,approved,0,1575254704,Peter Zenger,55122416,NYC,NULL,NULL
81,6,1575245071,"Just another day in the upside down.

Crime is innocence, corruption justice, lies truth.

The con man is the savior. 

Trump hasn’t shot anyone on 5th Avenue yet, but he’s making it clear he’d pardon others for it.",103918917,103918917,<br\//>,comment,1575239731,1,False,False,,,103918917,,20,0,[],0,approved,0,1575303075,Josh Wilson,74664877,Kobe,NULL,NULL
82,7,1575245071,"Chief Gallagher says at the end of this article, all the SEALS respect the president. My question is, why? Also, I doubt very much that they do. The president has done nothing to earn respect. He is the laziest man on the government payroll to date.",103918962,103918962,<br\//>,comment,1575240040,1,False,False,,,103918962,,20,0,[],0,approved,0,1575600787,John,26455951,"Baldwin, NY",NULL,NULL
83,8,1575245071,Trump just uses troops as props. They're all props. Cops. Firefighters. Handicapped kids.,103919258,103919258,<br\//>,comment,1575242679,1,False,False,,,103919258,,27,0,"[{'commentID': 103919875, 'status': 'approved', 'commentSequence': 103919875, 'userID': 77112720, 'userDisplayName': 'Roberta', 'userLocation': 'Kansas City', 'userTitle': 'NULL', 'userURL': 'NULL', 'picURL': None, 'commentTitle': '<br\\//>', 'commentBody': ""@Richard Sadly, your statement about trump using handicapped kids as a prop is true. He once had a disabled kid in a wheelchair kicked out of his rally because the kid was silently holding up a sign protesting against Trump's disparagement of people with disabilities.  Trump was so weak, he couldn't handle a kid in a wheelchair."", 'createDate': '1575248538', 'updateDate': '1575259648', 'approveDate': '1575251270', 'recommendations': 7, 'replyCount': 0, 'replies': [], 'editorsSelection': False, 'parentID': 103919258, 'parentUserDisplayName': 'Richard', 'depth': 2, 'commentType': 'userReply', 'trusted': 0, 'recommendedFlag': 0, 'permID': '103919875', 'isAnonymous': False}]",1,approved,0,1575303095,Richard,63116189,Savannah Georgia,NULL,NULL
84,9,1575245066,"The problem is Gallagher was aided by several other SEALs.  As horrendous as the sniper killing of a little girl, was the false confession by an 'immune to prosecution'  fellow SEAL to get this monster off the hook.  From a president with zero ethics flows his poison.  Wearing your MAGA patches with pride, SEALs?",103918673,103918673,<br\//>,comment,1575238315,1,False,False,,,103918673,,16,0,[],0,approved,0,1575600804,A. Reader,78642477,Ohio,NULL,NULL
85,10,1575245066,"After reading this stomach-churning report, I have only one word to describe Gallagher: Barbarian (i.e. brutal, cruel, primitive, unconscionable - qualities his commander-in-chief displays).",103918813,103918813,<br\//>,comment,1575239103,1,False,False,,,103918813,,13,0,[],0,approved,0,1575600811,Lawrence H,77356357,Brisbane,NULL,NULL
86,11,1575245066,"I saw people get 3 days bread and water for much less than what Gallagher did! I was in the navy 74-79, trumps intervention at that level is horrifying, he just pardoned war criminals how un American is that!? 
 the very thought that this cretin could be reelected is absolutely sickening.
 what is even more disturbing is the fact it could win, thanks to the electoral college you don't need to win the popular vote.",103919324,103919324,<br\//>,comment,1575243295,1,False,False,,,103919324,,12,0,[],0,approved,0,1575259173,bohica,91820799,buffalo,NULL,NULL
87,12,1575245066,"Chief Petty Officer Edward Gallagher

is going to go on Mr. Trump's campaign for 2020

and provide historic levels of joy

to Vladimir Putin.",103919354,103919354,<br\//>,comment,1575243612,1,False,False,,,103919354,https://s3.amazonaws.com/pimage.timespeople.nytimes.com/avatars/cropped-c0b5b1be806f809923b335fc58bd78b8dec78e129596fbd41102f67f62f5a434.jpg,16,0,[],0,approved,0,1575600823,Steven of the Rockies,63642297,Colorado,NULL,NULL
88,13,1575244374,"As a former Army Captain I am deeply disturbed by the politicalization, dangerous misuse and demagoguery for TV of the chain of command by Mr. Trump, all for political points. All soldiers, but especially senior enlisted like Chief Gallagher and officers are imbued with the “no politics” principle. One reason that our nation has been safe from military coups is that we have this strict code of conduct. As professional solders we are also taught that there are rules of war.

Chief Gallagher is a rogue, undisciplined  soldier. President Trump, having not served, is an undisciplined Commander in Chief with no understanding of the proud code in which we serve.",103919223,103919223,<br\//>,comment,1575242352,1,True,False,,,103919223,,416,0,"[{'commentID': 103919693, 'status': 'approved', 'commentSequence': 103919693, 'userID': 77112720, 'userDisplayName': 'Roberta', 'userLocation': 'Kansas City', 'userTitle': 'NULL', 'userURL': 'NULL', 'picURL': None, 'commentTitle': '<br\\//>', 'commentBody': ""@Sterno Trump has signaled that he'll sink to all new and dangerous lows to avoid losing power in 2020. He is trying to see how far he can push the military to act solely on his behalf, even if it means going against the rule of law. He treats the military as if it's his own personal toy that he can play with and use to wreak havoc. \nMeanwhile, the chaos of the trump administration is gradually chipping away at our national security, making us more vulnerable to foreign adversaries who wish to do us harm. trump keeps handing these foreign adversaries one victory after another, as he undermines or damages our Constitution, our free press, our environmental protections, the trust of our allies, our foreign civil service, our military, and so much more.  \nThis country cannot risk another 4 years with trump & the GOP running things. It's not safe for any of us.\nFor the 1st time in my adult life, I'll be a single issue voter in 2020 - that will be to get trump out of office. Same goes for the Senate & House Republicans who protect & enable trump at all costs to the country. Support him or not, Joe Biden is right -- 2020 elections will be for the soul of our country. Let's hope we can prevent trump from destroying it."", 'createDate': '1575246726', 'updateDate': '1587871852', 'approveDate': '1575246727', 'recommendations': 75, 'replyCount': 0, 'replies': [], 'editorsSelection': False, 'parentID': 103919223, 'parentUserDisplayName': 'Sterno', 'depth': 2, 'commentType': 'userReply', 'trusted': 0, 'recommendedFlag': 0, 'permID': '103919693', 'isAnonymous': False}, {'commentID': 103921468, 'status': 'approved', 'commentSequence': 103921468, 'userID': 89834366, 'userDisplayName': 'Paul Torcello', 'userLocation': 'Melbourne, Australia', 'userTitle': 'NULL', 'userURL': 'NULL', 'picURL': None, 'commentTitle': '<br\\//>', 'commentBody': '@Sterno If those words spoken in the article were indeed Gallagher’s then he should have been refused deployment: this is surely not the ‘Right Stuff’ that SEALs are meant to be...they’re meant to be Special aren’t they?', 'createDate': '1575277771', 'updateDate': '1575320922', 'approveDate': '1575280814', 'recommendations': 8, 'replyCount': 0, 'replies': [], 'editorsSelection': False, 'parentID': 103919223, 'parentUserDisplayName': 'Sterno', 'depth': 2, 'commentType': 'userReply', 'trusted': 0, 'recommendedFlag': 0, 'permID': '103921468', 'isAnonymous': False}]",2,approved,0,1587871772,Sterno,1378024,Va,NULL,NULL
