,index,approveDate,commentBody,commentID,commentSequence,commentTitle,commentType,createDate,depth,editorsSelection,isAnonymous,parentID,parentUserDisplayName,permID,picURL,recommendations,recommendedFlag,replies,replyCount,status,trusted,updateDate,userDisplayName,userID,userLocation,userTitle,userURL
31,6,1575392070,"The headline is a lie.  We do not imprison ""immigrants"" -- those who entered legally.  I was an immigrant.  And, even before I acquired citizenship, cleared for classified US military research.

We imprison those who have broken the law.

A law professor should not preach lies.",103935002,103935002,<br\//>,comment,1575342316,1,False,False,,,103935002,https://s3.amazonaws.com/pimage.timespeople.nytimes.com/avatars/cropped-dfcdf9e0d2fa610d10a961f10c991f5118c0974714c2405476c88f12c0517677.jpg,12,0,[],0,approved,0,1584803737,Austin Liberal,6998114,TX,NULL,NULL
32,7,1575392070,They are serving their purpose.,103943742,103943742,<br\//>,comment,1575389384,1,False,False,,,103943742,,3,0,[],0,approved,0,1575485800,Ryan Bingham,71851588,Up there...,NULL,NULL
33,8,1575392027,"So the conditions (according to this columnist) are terrible and we should get rid of immigration prisons.

Well, one way to insure not to end up in one of these (so called) prisons and endure these conditions...is to not break our immigrations laws in the first place by coming here illegally.

And as ""horrific"" as these conditions supposedly are, they apparently don't seem to be any type of a deturrent judging by the crisis at our southern borders",103933938,103933938,<br\//>,comment,1575336289,1,True,False,,,103933938,,17,0,[],0,approved,0,1588816880,DB,28840572,NYC,NULL,NULL
34,9,1575389552,"As a nation, we have a right and duty to decide how many people to allow in. 

We also need a mechanism for enforcing this decision, but it needs to be well managed, without the various cruelties listed and described in the article.  And it should not be done on a for-profit basis. 

I have to believe that our government is capable of managing a detention and removal system in a humane way; otherwise I would lose faith in our government's ability to do anything right. I'm not there yet. So by all means, let's fix it.

Conflating these two separate issues is a handy way to bias the decision in favor of more immigration, but this is a rhetorical sleight-of-hand that leads to false conclusions. If the enforcement mechanism is broken, we should fix it, not abandon it.",103943803,103943803,<br\//>,comment,1575389551,1,False,False,,,103943803,,11,0,[],0,approved,0,1575425854,mlbex,68197859,California,NULL,NULL
35,10,1575389255,"Rather than imprisoning illegal immigrants at considerable expense, the government should immediately deport them and their families, who cost society a great deal in terms of education, healthcare, etc . . .  The government should also impose steep fines on employers of illegal immigrants.  From the corporations in agriculture and construction to the families who hire nannies, employers fuel illegal immigration, leaving the shrinking middle class to effectively subsidize their businesses and tax evasion.",103942783,103942783,<br\//>,comment,1575387252,1,False,False,,,103942783,,18,0,[],0,approved,0,1584803757,Sharon,68567934,Washington,NULL,NULL
36,11,1575389251,"In 1965, when my wife was picked up by immigration police, her choices were deportation at US gov't expense which meant never ever being able to get a US visa or deportation at her own expense which meant returning home and starting at 0 in her wait for the lottery. I got her out by marrying her. She was detained in Manhattan civil jail which did not confer status as a criminal on her. (Civil jail was on the site now occupied by the Javits center. ) Children were not detained. That is how it was, not good but not egregiously sadistically nasty as it is now. And ICE didn't exist and we did just fine without them. What a waste!  How much tuition could you pay by eliminating ICE?",103936884,103936884,<br\//>,comment,1575363249,1,False,False,,,103936884,,1,0,[],0,approved,0,1575391565,Bill H,79407324,Champaign Il,NULL,NULL
37,12,1575389245,"Sure, lets have a Robin Hood department of justice and lawful restitution for all law offenders who can be deemed to be victims of a bureaucratic and legal system that is governed by 'abstract' ideas of sovereignty and protection of a nation.",103938381,103938381,<br\//>,comment,1575376980,1,False,False,,,103938381,,5,0,[],0,approved,0,1584804291,Nirmal Patel,87657455,India,NULL,NULL
38,13,1575389094,"Here in Minnesota, like much of the country, many jobs go unfilled.  I've worked with MANY immigrants of varying skills, ethnic and religious backgrounds, ages and education.  No exceptions, they work hard, have high degree of integrity and fit in as best they can.  When will we have a sensible immigration policy that permits these people to live without stress?  These prisons are the most inhumane aspect of our wildly broken immigration 'policy'.",103930962,103930962,<br\//>,comment,1575322136,1,True,False,,,103930962,,33,0,"[{'commentID': 103933517, 'status': 'approved', 'commentSequence': 103933517, 'userID': 85385264, 'userDisplayName': 'Blanche White', 'userLocation': 'South Carolina', 'userTitle': 'NULL', 'userURL': 'NULL', 'picURL': None, 'commentTitle': '<br\\//>', 'commentBody': ""@Annie \n\nI believe Minnesota should reach out to South Carolina.  Only a few years ago, I heard that, in Horry County, nearly 40% of young black men were unemployed.\n\nSo, perhaps incentives could be given such as housing to encourage them to move.  These days, its awfully hard to leave the support of family and pay rent and auto expenses, etc. in a new place.  The first third of the 20th century has passed and, without a support system, it's many times harder to make it. \n\nThere's labor in this country if anyone truly wants to find it.  I weary of those who say otherwise and continue to entice immigrants to exploit."", 'createDate': '1575334093', 'updateDate': '1584804306', 'approveDate': '1575334094', 'recommendations': 27, 'replyCount': 0, 'replies': [], 'editorsSelection': False, 'parentID': 103930962, 'parentUserDisplayName': 'Annie', 'depth': 2, 'commentType': 'userReply', 'trusted': 0, 'recommendedFlag': 0, 'permID': '103933517', 'isAnonymous': False}, {'commentID': 103931556, 'status': 'approved', 'commentSequence': 103931556, 'userID': 38777396, 'userDisplayName': 'Albela Shaitan', 'userLocation': 'Midwest', 'userTitle': 'NULL', 'userURL': 'NULL', 'picURL': None, 'commentTitle': '<br\\//>', 'commentBody': '@Annie \nWhen they come legally.', 'createDate': '1575324468', 'updateDate': '1584804308', 'approveDate': '1575335179', 'recommendations': 16, 'replyCount': 0, 'replies': [], 'editorsSelection': False, 'parentID': 103930962, 'parentUserDisplayName': 'Annie', 'depth': 2, 'commentType': 'userReply', 'trusted': 0, 'recommendedFlag': 0, 'permID': '103931556', 'isAnonymous': False}, {'commentID': 103946210, 'status': 'approved', 'commentSequence': 103946210, 'userID': 79342935, 'userDisplayName': 'Jim', 'userLocation': 'NC', 'userTitle': 'NULL', 'userURL': 'NULL', 'picURL': None, 'commentTitle': '<br\\//>', 'commentBody': '@Annie There have been no problems with legal immigrants during the Trump presidency. The criticism and enforcement has been focused on those who entered or stayed illegally. There is a legitimate position in hoping for increased legal immigration and border enforcement.', 'createDate': '1575394598', 'updateDate': '1584804318', 'approveDate': '1575394599', 'recommendations': 3, 'replyCount': 0, 'replies': [], 'editorsSelection': False, 'parentID': 103930962, 'parentUserDisplayName': 'Annie', 'depth': 2, 'commentType': 'userReply', 'trusted': 0, 'recommendedFlag': 0, 'permID': '103946210', 'isAnonymous': False}]",3,approved,0,1586410163,Annie,50714076,"United States, USA",NULL,NULL
39,14,1575388568,"I am staggered and horrified at the treatment of immigrants and refugees by my government.
I am paralyzed by the reality of children in cages. Worse than many internment camps, the children are without parents. The emotional harm done to the youth will reverberate into the future.
We deserve the strongest international condemnation. There will be no walls strong enough to protect us from the future world of civil disorder and mass migration due to climate change and political unrest.
The best of the human spirit does not build walls, but takes gracious steps toward healing despair. That is not what child prisons and indiscriminate walls between nations does.",103943380,103943380,<br\//>,comment,1575388567,1,False,False,,,103943380,,2,0,"[{'commentID': 103944053, 'status': 'approved', 'commentSequence': 103944053, 'userID': 85993911, 'userDisplayName': 'Susanna', 'userLocation': 'United States', 'userTitle': 'NULL', 'userURL': 'NULL', 'picURL': None, 'commentTitle': '<br\\//>', 'commentBody': '@Wyncia Clute A \n\nYour ‘vision’ for our country is a glorious picture of overpopulation, economic impoverishment, environmental decimation, and ideological/cultural divisiveness that would destroy this nation. \n\nWant to live in a third world country?  There are plenty to choose from. Go. Enjoy!', 'createDate': '1575390134', 'updateDate': '1584804324', 'approveDate': '1575392075', 'recommendations': 8, 'replyCount': 0, 'replies': [], 'editorsSelection': False, 'parentID': 103943380, 'parentUserDisplayName': 'Wyncia Clute A', 'depth': 2, 'commentType': 'userReply', 'trusted': 0, 'recommendedFlag': 0, 'permID': '103944053', 'isAnonymous': False}]",1,approved,0,1575394609,Wyncia Clute A,44477725,"Boulder, CO",NULL,NULL
40,15,1575388184,"I really have difficulty understanding the writers of this column.  Are the proposing that undocumented migrants be released on their own recognizance?

Why is no alternative to incarceration even mentioned?  If  the writers advocating open borders why don't they say so directly. 

I want the undocumented and those overstaying their visas to be treated humanely but any politician calling for open borders is committing political suicide and I sure hope the eventual Dem Pres. nominee articulates a clear plan that stresses both humane treatment AND rule of law.  

Immigration policy needs to be based on what the citizens of this country want- American tax dollars could be used much more efficiently through foreign aid (including family planning) than allowing an unregulated influx of people from failed states that aren't fulfilling a skill deficit here. 

And this policy has to be in sync with what serves our ecological interests as well.  Our human population in the U.S. has doubled in my lifetime and every additional human requires more land taken out of wilderness and used for agriculture, more carbon emissions and all the other pollution that comes from another consumer.  One thing I agree with Trump on- ""we are full"".  ZPG",103933697,103933697,<br\//>,comment,1575335052,1,True,False,,,103933697,,48,0,[],0,approved,0,1584804404,alan haigh,58853274,"carmel, ny",NULL,NULL
41,16,1575388130,"I represented asylum seekers as a pro bono attorney for many years in the Dallas, Texas Immigration Court for many years. One of my clients was an unaccompanied minor who had been detained in a jail for a year before I took on his case. All the clients I represented were fleeing legally defined persecution because of their nationality, ethnicity or religion. All of them deserved asylum under international law and U.S. laws and regulations. I only lost one case and sadly, that  asylum seeker was the most deserving but the particular immigration judge typically ruled against asylum seekers . Having established my ""credentials"" as a person who has assisted asylum seekers; I respectfully disagree with Mr. Garcia Hernandez's article. For example, he writes: ""And there will be others who get their day in court only to lose. When that happens, two options are available. We could arrest and deport these people, or we could turn the other way."" I assume he means we should just let them stay here regardless of the legitimacy of their asylum claim. The larger problem with the author's argument is that most of the people who show up at our southern border seeking asylum do not qualify for this status since they are not fleeing what international law and U.S. law defines as ""persecution"" - rather they are fleeing poverty, gangs and generalized violence in their home countries. The solution for human suffering is not open borders.",103943207,103943207,<br\//>,comment,1575388129,1,False,False,,,103943207,,12,0,[],0,approved,0,1584804432,Susie,66823405,Tampa Bay,NULL,NULL
42,17,1575388084,"A law professor should have a better understanding of incentives. If migrants know there's no detention, and that they will be provided free lawyers, social workers, and case managers to ""navigate the immigration process"", it's an open invitation to illegally enter the US.",103943185,103943185,<br\//>,comment,1575388084,1,False,False,,,103943185,,14,0,[],0,approved,0,1584804437,Max,10664125,NYC,NULL,NULL
43,18,1575388065,"This is a dilemma. Though the prison system is ripe with abuse, letting illegal immigrants who recently crossed the border roam free in the United States is also a problem. A nation without borders and immigration controls is not a nation. I do not care what the circumstances are, if one is not a U.S. citizen, one does not have the protections under the U.S. Constitution. Coming to the United States is a privilege, not a right. As a U.S. citizen and taxpayer, I ponder if an alternative is perhaps better than prison, but removing any sort of penalty for illegally coming to this country opens the floodgates to illegal immigrants, who desire resources already stretched thin for U.S. citizens.",103930595,103930595,<br\//>,comment,1575320771,1,True,False,,,103930595,,52,0,"[{'commentID': 103935018, 'status': 'approved', 'commentSequence': 103935018, 'userID': 55887036, 'userDisplayName': 'Eugene', 'userLocation': 'Washington D.C.', 'userTitle': 'NULL', 'userURL': 'NULL', 'picURL': None, 'commentTitle': '<br\\//>', 'commentBody': ""@Gregory Ziegler Which means that the best solution is the wall. Build the wall, and there won't be any immigration prisons. The US will then get to decide whom it takes in."", 'createDate': '1575342428', 'updateDate': '1584804462', 'approveDate': '1575342429', 'recommendations': 22, 'replyCount': 0, 'replies': [], 'editorsSelection': False, 'parentID': 103930595, 'parentUserDisplayName': 'Gregory Ziegler', 'depth': 2, 'commentType': 'userReply', 'trusted': 0, 'recommendedFlag': 0, 'permID': '103935018', 'isAnonymous': False}, {'commentID': 103935135, 'status': 'approved', 'commentSequence': 103935135, 'userID': 56972753, 'userDisplayName': 'Carla', 'userLocation': 'Brooklyn', 'userTitle': 'NULL', 'userURL': 'NULL', 'picURL': None, 'commentTitle': '<br\\//>', 'commentBody': '@Eugene \nWhat could does a wall do?\nThat means we are walled in too\nTo say nothing of the environmental destruction.\nIt is a stupid” solution” to a minor problem facing us, unlike other problems like  \nThe planet is burning.', 'createDate': '1575343117', 'updateDate': '1575404057', 'approveDate': '1575404057', 'recommendations': 0, 'replyCount': 0, 'replies': [], 'editorsSelection': False, 'parentID': 103935018, 'parentUserDisplayName': 'Gregory Ziegler', 'depth': 2, 'commentType': 'userReply', 'trusted': 0, 'recommendedFlag': 0, 'permID': '103935135', 'isAnonymous': False}]",2,approved,0,1586410220,Gregory Ziegler,76527834,"Washington, D.C.",NULL,NULL
44,19,1575387747,"Spend the money we spend on housing illegal immigrants on creating and enforcing E-Verify.  Start prosecuting those who knowingly employ illegal immigrants, including corporate CEOs, Beverly Hills housewives, construction contractors and Trump who employs illegal workers at his resorts, and everyone in between.  

The need to fill those jobs would give legal workers leverage to demand better pay and benefits.  

And that, of course, is why it won't happen, because having an endless in flow of desperate workers benefits our corporate overlords.",103931652,103931652,<br\//>,comment,1575324843,1,True,False,,,103931652,https://s3.amazonaws.com/pimage.timespeople.nytimes.com/avatars/cropped-fbb67f41492bb815b0d7302b7677f160f339bc28743730fecb990ed31e03c3f8.jpg,102,0,[],0,approved,0,1577303531,Livonian,76263903,Los Angeles,NULL,NULL
45,20,1575387568,"When does it stop? How many immigrants need to arrive until we say that we cannot take in any more?

What does a country do with more than 100,000 poor, uneducated people arrive -each month- who don't speak English and provide no real world contributing skills, yet demand asylum? 

What of the communities that have been flooded by recent immigration and are now faced with the problem of finding jobs for these people? Educating their children? Housing them? 
Who is going to pay all of this? You? How much more taxes are you willing to pay?

No. We do not need any more immigrants. Some claim that our population is growing old and the influx of new immigrants is required. Those voices arise from the almost empty churches, the low paying farmers and construction companies. 

Automation, robotics and a lower population will be the cure for most of the problems we face today. Never try to fix tomorrow's problems with yesterday's answers. 

We need to educate girls and women around the world. We need to limit the number of children anyone can have -until they have proven that they can afford to take care of themselves.

Trump propaganda? Fear and racist type of theme? No. There is a difference between blame, empathy, and ignorance, yet César Cuauhtémoc García Hernández tries to blend them all. 

Simply: I have just grown tired of having to fix other people's problems.",103936103,103936103,<br\//>,comment,1575349987,1,False,False,,,103936103,,65,0,"[{'commentID': 103944117, 'status': 'approved', 'commentSequence': 103944117, 'userID': 44766294, 'userDisplayName': 'John Brown', 'userLocation': 'Idaho', 'userTitle': 'NULL', 'userURL': 'NULL', 'picURL': 'https://s3.amazonaws.com/pimage.timespeople.nytimes.com/avatars/cropped-6375f649bb111dd2b97eb268e2b32ec9604d6388be2b2f79b536d7d56c3b09e1.jpg', 'commentTitle': '<br\\//>', 'commentBody': ""@Allen Yeager \n\nWe need to develop an Immigration policy that is fair.\n\nHow is it fair to Poor American Citizens to allow Immigrants who will directly compete with them for Jobs, for Housing, for Medical Care and overfill their local schools - just, as you say, so Farmers, Light Construction, \nRestaurants can have an endless supply of cheap labor ?\n\nIf hundred of thousands of qualified lawyers, doctors, editorial writers, professors, judges, politicians\nand other professionals were \nentering the country and the wages of American professionals were dropping to minimum wage, the houses they wanted were being bought up - Trump's Wall would be built by tomorrow afternoon.\n\nIf there are jobs that no American citizen will take and that pays a living wage, then set up a computer system that allows Worker Immigrants to be given a Work Card for that job and if the Immigrant commits no felonies and agrees and does actually return to their country of origin let them accumulate points toward a Green Card and apply for the next job.\n\nIn the meantime the United Nations should work diligently at improving the lives of those in the countries where so many wish to emigrate from.\n\nWhy are we standing by why Drug Lords, mostly financed with the money of American Drug Addicts, destroy their own countries ?\n\nI don't find fault with anyone wishing and seeking a better \nand safer life for themselves and their families, but why must the Poor of America bear the brunt of the burdens of Immigration ?"", 'createDate': '1575390270', 'updateDate': '1584805097', 'approveDate': '1575390272', 'recommendations': 8, 'replyCount': 0, 'replies': [], 'editorsSelection': False, 'parentID': 103936103, 'parentUserDisplayName': 'Allen Yeager', 'depth': 2, 'commentType': 'userReply', 'trusted': 0, 'recommendedFlag': 0, 'permID': '103944117', 'isAnonymous': False}, {'commentID': 103936844, 'status': 'approved', 'commentSequence': 103936844, 'userID': 30913699, 'userDisplayName': 'AS', 'userLocation': 'LA', 'userTitle': 'NULL', 'userURL': 'NULL', 'picURL': None, 'commentTitle': '<br\\//>', 'commentBody': 'It is the fault of the US that these people are so poor.  Borders should be abolished.', 'createDate': '1575362286', 'updateDate': '1575463362', 'approveDate': '1575402929', 'recommendations': 1, 'replyCount': 0, 'replies': [], 'editorsSelection': False, 'parentID': 103936103, 'parentUserDisplayName': 'Allen Yeager', 'depth': 2, 'commentType': 'userReply', 'trusted': 0, 'recommendedFlag': 0, 'permID': '103936844', 'isAnonymous': False}]",2,approved,0,1584805079,Allen Yeager,67931029,"Portland,Oregon",NULL,NULL
46,21,1575387551,Every crime committed by an undocumented person was preventable by respect for the law or better enforcement. The professor’s argument is unmindful of the victims of these tens of thousands of crimes. Where’s the compassion for those preyed upon because of lax border security? Why should we tolerate preventable crime?,103932137,103932137,<br\//>,comment,1575327166,1,False,False,,,103932137,,67,0,"[{'commentID': 103936365, 'status': 'approved', 'commentSequence': 103936365, 'userID': 53148876, 'userDisplayName': 'CG', 'userLocation': 'Chicago', 'userTitle': 'NULL', 'userURL': 'NULL', 'picURL': None, 'commentTitle': '<br\\//>', 'commentBody': '@Addison Clark where are you getting the idea that ""tens of thousands of crimes"" are occurring? are you suggesting that somehow, just by possessing a piece of magical paper - ""the visa"" - you\'ve now become a valid individual in the eyes of the law, according to y\'all, not able to hurt a fly, much less an red blooded American!', 'createDate': '1575352739', 'updateDate': '1575393077', 'approveDate': '1575393077', 'recommendations': 0, 'replyCount': 0, 'replies': [], 'editorsSelection': False, 'parentID': 103932137, 'parentUserDisplayName': 'Addison Clark', 'depth': 2, 'commentType': 'userReply', 'trusted': 0, 'recommendedFlag': 0, 'permID': '103936365', 'isAnonymous': False}]",1,approved,0,1584805136,Addison Clark,61158813,Caribbean,NULL,NULL
47,22,1575387535,"Send them back home as quickly as possible. Let’s spend that prison money on our own citizens. We should also recognize that if they are dealing meth or heroin they are a threat to us and our families. In that case they should be labeled as “enemy combatants” and held in military prisons until the drug crisis abates. That might take a generation, or two. After all, “no one is forcing them to sell  drugs to our children.”",103931095,103931095,<br\//>,comment,1575322595,1,False,False,,,103931095,,94,0,[],0,approved,0,1584805157,Rogue Warrior,64824596,"Grants Pass, Oregon",NULL,NULL
